option_a,votes_a,option_b,votes_b
Never be able to hear your favorite song again,648365,Never be able to watch your favorite movie again,624474
Be a rich but stupid footballer,641551,Be a genius but poor scientist,637042
"Eat a rotten, raw steak",528941,Eat a human's cooked liver,687194
Never be able remember anyone's birthday or anniversary,678202,Forget every historical date from the past and why it was important,556143
Shower with Jerry Sandusky,135993,Be a victim of a Catholic priest,61667
Only be photographed,682863,Only be filmed,603799
Have the beginning of Circle of Life play when you farted,480977,Have the chorus of Thriller play when you burp,698023
Be forced to watch My Little Pony for 24 hours,1131475,Have the theme song stuck in your head for the rest of your life,159589
Paint your nails,611549,Wear high heels,140742
Be confined to a wheelchair for the rest of your life and be able to have children,440644,Be able to walk but unable to have children,786624
"Always call fingering ""fingerblasting""",133570,"Always call blowjobs ""blowjays""",106614
Have dropped the first atom bomb on Japan,191762,Have operated a gas chamber during the Holocaust,53568
Always have mud in your shoes,555098,Always have a pebble in your shoe,679459
Be convicted as a corrupt politician,378693,Be convicted as a corrupt Fortune 500 CEO,678481
Need glasses to see far away,880969,Need glasses to see close up,374550
Be a fairy who cannot fly,672571,Be a 10 foot tall dwarf,579420
Get a Hole-in-One and have to buy the whole bar a drink?,426876,No Hole-in-One,759407
Eat nothing but dog treats,951153,Eat nothing but cat food,285030
 get a sex change,114,Be a virgin for life,76
Be locked in a chastity belt,4,Gangbanged 3 times a week,1
"Be well dressed from the waist up, with ridiculous pants and shoes",675451,"Be well dressed from the waist down, with ridiculous shirts and hats",500116
Travel the world and die young,5,Stay at home and get old,5
Be Canadian,3,Be American,2
Have it done slowly with a chainsaw,4,Have it done with an axe,6
Eat 5 live rats,49317,Chew on Donald Trump's pubic hair for 5 seconds,187877
Marry a hardened criminal,588757,Marry someone with 5 kids from 3 previous marriages,635927
Be a vampire who can transform into a bat,722674,Be a ghost that can possess only appliances,529773
Fight a tiger,4,Fight a shark,9
See into the future,2,Have the ability to go into the past,5
Have a good life in a small house,4,Have a miserable life in a billion dollar mansion,1
Play quarterback,810772,Play linebacker,314563
Sleep in a tanning bed for a month,537824,Sleep in a small suitcase for a month,673092
Have everybody stare awkwardly,1035574,Have everyone look away in disgust,198789
Have your eye held open by someone while they slice/paper-cut your eye,22,Have your eye held open by someone while they take a razor to your eye and start shaving your eye away,5
Superman,23,Batman,15
Be homeless and hungry but always loved by your perfect partner,791139,Have a fabulous house and amazing food but never have loved or been loved,448737
Be a vegetarian and love a meat eater,244495,Be a meat eater and love a vegetarian,1025275
Become Homosexual and find the love of your life,12,Stay Heterosexual and never find anyone who'll even kiss you,6
Be Blind,2, Be Deaf,1
Have everyone stare at you in disgust,413008,Have everyone look away in disgust,789735
Go to jail for life,608863,Have the death penalty,665315
Rip up the exam paper,239326,Walk out laughing,1031800
Be named after a car,1014088,Be named after produce (fruits or veggies),248453
Spend your last moments with your family,651416,Do something crazy that you've always been too scared to do,620397
Get fingered by a gorilla,76293,Finger a Gorilla,159024
Be eaten by a lion,1102957,Be eaten by ants,179160
Know when the world ends,503999,Know how the world ends,802397
Be a Prince/Princess,864577,Be a Mermaid/man,412244
Find true love,512685,Cure cancer,806041
Slay the dragon,613919,Rescue the princess,682107
Visit Hogwarts,839753,Visit Narnia,437010
Fart in front of your crush,922699,Get caught picking your nose by your crush,316840
Have a nail hammered through every joint in each of your fingers,331882,Have the famous Starry Night slowly carved into your back with a knife,748242
Own a pocket-sized giraffe,585155,Own a pocket-sized elephant,704056
Have your foot stepped on by an elephant,727966,Have your foot bitten by a lion,505127
Have sex with a celebrity for a week and then no sex ever again,76062,Have sex with below average people for the rest of your life,170710
Enact Net Neutrality as a law,544572,"Enact the ""Stop Online Piracy Act"" as a law",393930
Find a book about everything about the past,300504,Find a book about everything about the future,967792
Have blue skin,881810,Have red skin,416419
Sprout a tail,855435,Sprout a horn,365489
Spend a day with Michael Jackson,192750,Spend a day with a Catholic Priest,54092
Be a robot,606183,Be an alien,682532
Be resistant to cold and impossible to freeze to death,477728,Be resistant to heat and impossible to burn to death,766576
Use only Comic Sans,626773,Use only Papyrus,468236
Own a mini horse,520938,Own a regular horse,747618
Be smart and always be ignored,865228,Be dumb but always listened to,400533
Switch sexual orientation,176128,Be permanently obese,63123
Be blind,145765,Have penises for arms,104892
Read the book,537835,See the film,758495
Be publicly accused of 1st degree murder,198725,Be publicly accused of pedophilia,43383
Try acid once,70066,Try magic mushrooms once,172594
Be raped by a group of 10 year old boys,93244,Be raped by a wolf,147619
Sit on a cold toilet seat,680877,Sit on a warm toilet seat,621110
Have sex with a wolf,184326,Have a wolf have sex with you,54224
Be visited by Ancient Aliens,954652,Be visited by Mole People,234694
Get stung repeatedly by a Japanese Hornet,392436,Be bitten once by a Black Widow spider,748896
Be a student the rest of your life,604900,Be a teacher the rest of your life,665939
Eat a Rotten Banana,210823,Suck an Old Guy's Dick,34191
Give your friend a blowjob and escape,117312,"Stay in the room for an entire week, without food or water",86616
Snow for the rest of your life,768389,Rain for the rest of your life,524912
Have the ability to pull out of your pockets the exact change needed for ANY purchase,399933,Have the ability to discreetly read minds,845427
Need to milk yourself,551200,Lay an egg,696596
Be a capitalist,750766,Be a communist,384764
"Unearth and loot a corpse, finding a Rolex",454467,"Cheat in a competition, winning a Rolex",695817
Be a content failure,648821,Be an unhappy success,549486
Die a hero,848364,Live long enough to see yourself become the villain,419382
Be a Lefty,315175,Be a Righty,976008
Be married to someone that doesn't love you,405346,Be married to someone that you don't love,796681
Burp confetti,710983,Fart glitter,560102
Be a superhero and hated by everyone,861606,Have no arms or legs but be loved by all,397945
Have your testicles sandpapered off,147065,Be locked in a room full of your dead family members and the only way to survive is to eat them,81884
Be married to someone who doesn't love you,418034,Be married to someone you don't love,781489
Never have to grocery shop again.,407119,Never have to do laundry again.,854261
Be a famous country singer,515412,Be a famous blues guitarist,703893
Have to eat tree bark for one meal a day,542388,Have to pour cold milk over everything you eat,641346
Eat all your meals where the food is freezing cold,769284,Eat all your meals with 5 tablespoons of salt poured on it,422059
Go to the dentist,494726,Watch women's sports,791207
Every movie you watch replaces the lead role with Nicolas Cage,825088,Every song you hear is performed by Nickelback,357286
Never have sex,107238,Be a sex addict that has a ton of kids,140202
Be anorexic,724914,Be obese,467127
Resurrect your favorite cancelled show of all time for 1 season,604361,Cancel your most hated show,609972
Wear the KKK robes for life,662173,Tattoo Swastikas on both of your cheeks,448372
Eat a hotdog,330377,Eat a hamburger,935624
Work 9am to 5pm,1021720,Work 9pm to 5am,256338
Vote for Bachman,469593,Vote for Palin,435550
"Spend five years in prison, but return to your old life with no ill consequences.",720845,"Never go to prison, but move every year for the rest of your life.",594620
Be able to control/talk to machines,407066,Be able to produce an unlimited amount electricity,825402
Have sex with your mom,87680,Have sex with a group of little boys,117446
Have sex with your mom,85909,Have sex with a group of little boys,115961
Feel like you have to sneeze all the time,608828,Feel like you're about to fall all the time,606767
"Have a 5 year, absurdly sexual relationship with Clay Aiken",106963,"Have a one night stand with Clay Aiken, professionally video taped, and released via a major porn distributor",91810
Be permanently mute,644859,Amputate one of your arms,573718
Be able to kill anyone by writing their name in a notebook,316332,"Be able to heal anyone of any injury/illness, or revive the dead via a kiss",952509
Live in a foreign city and not know the language,842146,"Live on an island, alone",389266
Not wear shoes for the rest of your life,737135,Not drive a car for the rest of your life,513443
Be a virgin for the rest of your life,169297,Have AIDS until the day you die,74512
Have a one inch penis,159266,Have penile cancer,68759
Be able to speak every language in the world fluently,600534,Be the best in the world in one category of your choosing,639711
Wear nothing but jeans,721459,Wear nothing but shorts,546763
"Live in a library, where books are your only form of entertainment",716225,"Live in a prison cell, where you have access to any channel on TV",512693
Have to live Adolf Hitler's Life,478792,Have to live Joseph Stalin's Life,673422
Be deaf,584898,Be Amish,616670
Find $1,767650,Read a book,547897
Have sex with a fat ugly person,145424,Have sex with a hot person that has an STD,96409
Be handcuffed to your worst enemy for life,854441,Be separated from your entire family for life,361676
Drink the same thing,1037339,Eat the same meal,222354
Non-stop peeing for the rest of your life,489740,Non-stop crying for the rest of your life,741252
Be Buddhist,732085,Be Jewish,451257
Be killed by Jason (Friday 13th),574801,Be killed by ghostface (Scream),541272
Chill With Eminem,847999,Chill With Jay-Z,349831
Be a high school or below teacher,347279,Be a college professor,888182
Have your best friend be a girl,671955,Have your best friend be a guy,589818
Fight Voldemort,857015,Fight Freddy Krueger,350519
Burn your family to death,50818,Nuke your hometown with all your friends in it,179518
Have your testicles crushed,123225,Have your eyes gouged out,63035
Be a dinosaur,835290,Be a narwhal,408732
Eat a quarter,378022,Eat Chapstick,822047
Play for the Red Sox,375106,Play for the Yankees,693309
Never be able to look in the mirror again,442694,Always get dressed in complete darkness,781383
"Fight 100 third graders, one at a time",949615,Fight 50 third graders at the same time,296397
Be a Devil,219024,Be a God,1050058
Be forced to listen to Justin Bieber sing live,136175,Have a cute person of the other gender fart in your face for the equal amount of time,113498
Have both sets of genitals,79838,Become the other gender,162033
Arm yourself with the most powerful Nerf guns,643274,Arm yourself with the most powerful Super Soakers,559363
Lick peanut butter off of a hobo's foot,275580,Lose 250 dollars in the stock market,934661
Be a ghost,815738,Be a demon,449776
Have it always be day,733826,Have it always be night,530454
"Live poor with Jesus Christ, then go to Heaven",907660,"Live richly with Satan, then go to Hell",326110
Die slowly but not much pain,937583,Die fast with a lot of pain,315312
Hug a Panda,913298,Hug a Polar Bear,366757
Smash a computer with a baseball bat,579191,Smash a guitar on the floor,662999
Own a lightsaber,293113,Know the ways of the force,948768
Never be able to eat Chipotle again,1000076,Never eat dessert again,211893
Watch an uninterrupted WNBA double header,394870,Listen to an entire Nickleback CD in one sitting,675672
Be a slave in the pre-Civil War south,728020,Be a slave in Ancient Egypt,424189
Have a Pinocchio nose,579937,Have Dumbo ears,611003
Have to wear a Barney costume for the rest of your life,489542,Have to eat a bowl of cereal and mustard every morning,678833
Become a Spartan (Halo),905410,Become a Cog (Gears of War),186583
Be allergic to sugar,390368,Be forced to wear ponchos 24/7,843677
Have a massive head compared to your body,442276,Always have a bowl cut,711993
Watch the sad SPCA comercial over and over,313583,Watch bad workout infomercials over and over,737117
Be a professional skier,268495,Be a professional snowboarder,928068
Take 3 shots of dip (tobacco) spit,424422,Take 3 shots of dirty bong water,627286
Only be able to meow yet live nine lives,337288,Be able to talk and live once,891847
Light your hands on fire for a minute,440857,Light your feet on fire for a minute,760656
"Start every sentence with ""if""",688786,"Start every sentence with ""but""",471148
Say YES (or similar words) to everything,863592,Say NO (or similar words) to everything,341781
Have an urge to poop for a full day in a small room alone,154219,Have an erection with your mom in a small room,78570
Be sent into space without enough oxygen,822876,Be thrown naked into a pit of deadly scorpions,385176
Be a Hippie,602046,Be a Gangsta,645100
Fight Spock,503877,Fight Kirk,549303
Lose an eye and a hand,400971,Lose a leg and an ear,786764
Live in a penthouse in L.A.,755529,Live in a townhouse in London,456136
Have ice breath,666884,Have fire breath,609537
Have all your limbs cut off by a very dull butter knife,175679,Have to go to every single local WNBA game for the rest of your life,975765
Live with no electronics,836170,Live with no friends,429120
Have sex with two transvestites,171079,Have sex with a dog,57980
Fight Cybermen,597845,Fight Daleks,372861
Drive a smart car,552491,Drive a Lamborghini and fill up 4 times a week,676150
Have a pet monkey,742305,Have a talking parrot,502472
Live in a Toyota Prius,682362,Live in your bathroom for the rest of your life,500795
Be stranded alone,415624,Be stranded with someone that you hate,820926
Be naked all the time,728659,Never leave your house/apartment,509633
Smoke pot with Batman,157509,Smoke pot with Spiderman,91059
Get 4 hours of sleep per night,509679,Get 15 hours of sleep per night,742852
Be an amazing security guard,853682,Be a terrible FBI agent,389811
Slam your penis in the car door once,123999,Get kicked in the balls every day for two weeks,70097
Be barefoot for the rest of your life,688283,Wear Crocks for the rest of your life,532374
Be really fat,336027,Be really hairy,887643
Be addicted to steroids,521954,Be incredibly frail,600586
Your piss smells like McDonalds French fries,635690,Your poop smells like Burger King whopper.,582870
Have the first dibs every time,535877,Always have the last laugh,653610
Eat every meal mixed with Carbonara sauce,497896,Drink every drink mixed with Four Loco,510572
Have a huge head and a small neck,776946,Have a huge neck and a small head,384201
Get your kidney ripped out,103915,Get raped by someone you hate,133646
"""Get Funky"" with BeyoncÃ©",57560,"""Rock the Casbah"" with Megan Fox",159134
Live in Hyrule,467515,Live in the Mushroom Kingdom,624081
Be punched in the face with brass knuckles by Mike Tyson,565699,Punch a toddler and be seen by thousands of people,612014
Be fed to a Rancor,504589,Be fed to a Sarlacc,407573
Always watch Nicolas Cage movies,629894,Always watch Owen Wilson movies,484458
Never eat pizza again,505009,Never drink another soda,755918
Be known as a dick for life,136615,Be known to have a small dick,60547
"Be accomplished and famous, then die at 18",233276,Be ordinary and die at a reasonable age,994961
Eat a spoonful of cinnamon,903580,Snort mustard,257171
Be awake during spine surgery and hear the bones crunching,339470,Be awake when they twisted a extremely broken arm back into place,800040
"Own 10,000 Mr. Potato Heads",434194,"Own 10,000 bobble heads",753591
Be the best singer in the world... but ugly,462988,Be the worst singer in the world... but beautiful,760628
Be forced to attend school for your entire life,529539,Be forced to marry your distant cousin,680037
Have it facing the wall,282693,Have it facing away from the wall,845651
Teach Spanish,557755,Teach math,688128
Eat two pounds of human fat,146748,Drink a liter of genital sweat,69679
Be extremely unattractive,491215,"Be extremely attractive, but have a hand that smells perpetually like poop",686925
Live in the world overrun by Zombies,585386,Live in the world of My Little Pony,669364
Be starving for the rest of your life,552857,Or obese for the rest of your life,620020
Cut off each individual toe with a knife,692971,Pull out each tooth with pliers (including molars),380949
Be a girl with a buzz cut,315564,"Be a boy with thick, long, curly hair",880105
Drink a gallon of mustard in one sitting,518656,Use mustard as toothpaste for 3 weeks,607263
Be Australian,528244,Be American,738855
Be chinese,351319,Be japanese,883030
Be Gandolf,486123,Be Luke Skywalker,694615
Eat soup for every meal with only your face,902859,Stab your tongue with a fork every time you ate,248627
Listen to only one song for the rest of your life,871758,Listen to no music for the rest of your life,335837
Eat waffles,604454,Eat pancakes,634259
Watch your parent's sex tape,93406,Watch you and your girl/boyfriend's sex tape with your parents,136450
Assassinate Martin Luther King Jr.,102019,Assassinate Mahatma Gandhi,122426
Be in a no-named rock band,638983,Be in a wildly popular kids band like the Wiggles,516954
Chop off your own arm,499440,"Chop off a complete strangers arm, but they come back to kill you in 30 years",688288
Buy a gun,129541,Buy a passport,121241
"Have sex with a Siberian Tiger, everyday for the rest of your life",177333,Live with 1000 pregnant Camel Spiders,48097
Kill Hitler,200900,Kill Lee Harvey Oswald,41607
Eat 100 ants,951767,Eat 50 beetles,215693
Be smart and unlucky,483987,Be dumb and really lucky,750057
Be a gangster,565370,Be a freemason,580655
Swim in a pool of period blood,115555,Swim in a pool of semen,115123
Be bilingual,194786,Be bisexual,50271
Be sexually deprived,98362,Have chronic masturbation problems,132060
Live forever (or until the end of the Universe),1050169,Die right now with no afterlife,176604
Eat the rotting corpse of a skunk,49705,Eat pubic hair,169653
Get killed by your boyfriend/girlfriend,692400,Get killed by your best friend,507398
Run into a full grown Alien from Alien,518277,Run into Predator,605773
Slam your hand on top of a thumbtack with a half inch pin,632678,Shoot yourself in the top of the foot with a nail gun,431882
Shoot a shotgun,679512,Shoot a handgun,524063
Porsche,389556,Ferrari,826948
Death by firing squad,889201,Death by hanging,284301
Be stuck in a aquarium with a great white shark,769336,Be stuck in a room where the floor is covered in a layer of spiders,414996
Lose the ability to feel emotions,912677,Be physically paralyzed,283356
Know the exact time and place of your own death,517561,Know the exact time and place of death of everyone around you,686581
Be able to travel at light speed,468244,Be able to read minds,784976
Eat your own hand,759176,Eat a loved ones eye,389823
Have anal with a transexual,55838,Have oral with a transexual,121710
Be in the Justice Leauge,331187,Be an Avenger,853347
Be stuck on the moon,617557,Be free floating in space,600363
Spend Monday to Saturday knocking down the wall off China for the rest of your life,510720,Never be able to leave your bedroom,658296
Live in your dream house thousands of miles from any civilization,841659,"Live in the city of your dreams, in a small house, with five foreigners you can't understand",314763
Sing everything you say,675336,Dance all your movements,539458
Be a motherfuckin' wizard,216248,Be King of England,36333
Be a Wizard,1012661,Be the King of England,231067
Run someone over,799556,Be run over,413411
Have a very attractive spouse that treats you badly,392186,Have an ugly spouse that adores you,754688
Take a load in the ear everyday,125707,Take a load in the mouth and swallow it everyday,52502
Be thrown into a snake pit,767610,Be thrown into a spider pit.,408554
Skyrim,656008,Modern Warfare 3,488348
Save the Library of Alexandria from burning,398368,Know what happened to Atlantis,764816
Kill your daughter to save an entire country from a huge catastrophe,530457,Be the cause of the catastrophe that destroys a country,640816
Eat 300 doughnuts in 4 hours for $500,834167,Drink a cup of sour milk for $50,369334
Lie every time you are asked a question,304364,Tell the truth every time you are asked a question,897916
Be a Muslim,347799,Be a Jew,784227
Be Zeus,834389,Be Poseidon,369075
Always take cold Showers,477163,Never feel anything cold,751850
Eat a pie,795444,Eat a grape,438084
Eat only buffalo wings for the rest of your life,1064619,Drink only buffalo sauce for the rest of your life,92779
Poop rainbows,735334,Vomit rainbows,513291
Have to watch your parents have sex every day,95550,"Join your parents having sex once, and never have to watch them again",115389
Be 21,1043570,Be 10,239904
Eat what you find in a dump,274764,Eat sealife from the bottom of the sea,853899
Give birth,174389,Be hit by a lacrosse ball that bursts 1 of your balls,62102
Have created Facebook,877099,Have created Twitter,355200
Leave Earth forever and live with a race of aliens,296581,Get to meet a race of aliens but stay on Earth,899992
Eat a breakfast of only jellybeans,339257,Eat a breakfast of only hot wings,865346
Be with a blonde,275145,Be with a brunette,478572
Eat 25 toenails,323084,Snort a tablespoon of cinnamon,826508
Use a spoon,429391,Use a fork,800619
Receive $5 a day for the rest of your life,650939,"Receive $50,000 right here, right now",606190
Lick the armpit of a sweaty cab driver.,911103,Eat the ear wax of an old man who has never cleaned his ears.,126539
Pick the red option,419,Pick the blue option,516
Be walked in on while watching porn,58557,Be walked in on while watching Celine Dion music videos,141273
Live happily ever after with your favorite romance novel hero,122996,Live happily ever after with your favorite movie/TV show hero,567851
Be a spokesperson for an erectile-dysfunction treatment,112552,Be a spokesperson for a diarrhea/constipation remedy,97954
Have your current pet live as long as you do,769980,Bring a past pet back to life,400290
Have a stylist do your hair and makeup every day,286241,Have a fashionista pick you a new outfit every day,425217
"Win a $5,000 shopping spree to any store",553866,Win a 10-day free vacation to any destination,659879
Have your face covered in severe acne,825074,Be extremely fat,372853
Have a micro-penis,45235,Only be able to get an erection < 10% of the time,183348
Sleep on a pillow with a blood stain,621662,Sleep on a really hard and uncomfortable pillow,580234
Have to give a graphic naked picture of yourself to anyone who asked for it,781172,Give up sex,398236
Be featured on the show Bridezillas,331500,Be featured on the show What Not to Wear,656402
Own a baby otter,431865,Own a messenger owl,773790
"Be chased by 100 rabid squirrels through a flat, open plain",522699,Go down a 200 ft slide completely made out of ice head first with your shirt off,575247
"Have a terrible audition on ""American Idol""",674770,"Get a ridiculously easy question wrong on ""Who Wants to be a Millionaire""",467741
Attend Hogwarts,694793,Attend Xavier's School for Gifted Youngsters,482426
Mansion in Beverly Hills,640850,Penthouse in Manhattan,507632
Serve 7 years in a rough prison,687290,Kill and eat your pet dog,504319
Pee your pants once a day at a random time,1044469,Poop your pants once a day at a random time,133383
Have a house made of sprawling underground rooms and tunnels,616049,Have a small flying house,550445
Smell like farts all the time,254527,Get sprayed by a skunk once a month for the rest of your life,867411
Wear ugly gloves,832889,Wear an ugly hat,350031
Prostitute,156826,Nun,90235
Amputate the feet of two friends,675490,Amputate one of your own feet,464847
Have all of Disney World to yourself for one day,578264,Spend a day at the Playboy mansion,642962
Get a free appetizer with every meal,453999,Get a free dessert with every meal,747290
Be part of a real Jurassic Park scenario,685976,Be part of a real Day After Tomorrow scenario,432682
Reach your ideal salary,832980,Reach your ideal weight,367947
Win a 1-day shopping spree to any store,508179,Win a 2-week vacation to any destination,691041
Glue your eyes shut with super glue,244655,Spill hot glue over your naked lap,881152
Enter a sicilian bull,202362,Wear spanish boots,770509
Be waterboarded to death,408929,Be electrocuted to death,709704
"Inherit $15,000 from a distant relative",126692,Have you penis magically grow an extra inch in length and girth,73946
Have sex with Ryan Gosling,100658,Have sex with Taylor Lautner,91713
Have a penis shaped scar on your forehead,113199,Have your entire mid section and torso be terribly scarred and deformed,117188
Have 20 million YouTube subscribers,658463,Produce a blockbuster action movie,567626
Be unable to survive without eating something every hour,717340,Be unable to taste anything for the rest of your life,445707
Night vision,674335,Heightened senses in smell and hearing,528792
Have a Ford,619610,Have a Chevy,520706
Drink 5 oz. of vodka by nose,909220,Drink 5 oz. of hot sauce by nose,210166
Kill someone you hate and get caught,961366,Kill someone you love and never get caught,205522
Never shave ever again,826297,Never cut finger/toe nails ever again,372712
Meet your idol,680587,Be popular at school,535797
