option_a,votes_a,option_b,votes_b
Kicked in the balls by Bruce Lee with Iron Shins,0,Punched in the throat by Mike Tyson with brass knuckles.,0
Rape a alive person,2,Rape a dead person,1
Bring Michael Jackson back to life,0,Bring Elvis Presley back to life,0
Have a nice looking car that breaks down every month,0,Have a very rusty car that never breaks down,0
Mitt Romney,0,Ron Paul,0
Play Russian Roulette with 5 bullets.,0,Be forced to be on Chat Roulette for the rest of your life.,0
Like a perfect person,1,Love an ordinary person,0
Lindsay Lohan,0,Paris Hilton,1
Bellyflop off a 50 foot cliff into water,2,Stay underwater for 2 minutes,0
Give a kiss every time you greet a family member,0,Hug every non family member you greet,1
Dumb and Happy,0,Smart and Depressed,1
Infinite Hearing,0,Infinite Vision,0
No Brain,0,No Balls,0
Have more intelligence,1,Have more money,5
Be a wealthy person in England during World War II,1,Be a wealthy person in America during The Great Depression,1
Creationist,0,Understanding of science,3
Be an only child,1,Have a brother and a sister,3
Leave him/her alone in the woods and he eventually dies,2,Watch Hoodlums beat him/her to death and you can't do anything,0
Be a famous swimmer,0,Be a famous golfer,0
Pizza,2,Hot dog,1
Grow wings,3,Have gills,0
Be covered by bees.,1,Be surrounded by rattle snakes.,5
Marvel Comics,1,DC Comics,0
With your breasts showing,3,Have your private area showing.,0
Be married to an abusive jerk and can not get a divorce or leave him.,0,Be single until you die.,2
See your mom naked.,0,See your dad naked.,1
Poop your pants once a day.,2,Throw up five times a day.,1
Dancer,5,Singer,1
Be Jason Voorhees,0,Be Michael Myers,1
Be Ron Jeremy,0,Be Hugh Hefner ,0
Be Optimus Prime,1,Be Megatron ,1
Be Rambo,0,Be Bruce Lee,1
Be Master Chief ,0,Be Marcus Fenix,0
Be Ozzy Osbourne ,1,Be Motorhead,0
Watch all the Twilight movies with a fan fanatic for five straight days,1,Watch Glee for 25 hours straight with no sleep ,0
Sonic The Hedgehog,1,Shadow The Hedgehog,0
Aids,0,Herpes,0
Suck on a sweaty arm pit,1,Drink balls sweat,0
Film,0,Digital,3
Freakishly tall.,0,Freakishly short.,0
Wipe away from you,0,Wipe towards you,0
Do the ugliest woman on earth,4,Do a dog,9
Have sex with an underage girl/boy who wanted it ,2,Have sex with an extremely ugly person of the same sex,0
Be a toilet,1,Be a sex doll,2
Choose a crowbar,0,Choose a AK47 with limited ammo,0
Own an android ,1,On an iphone (any model) ,0
Control Time,1,Control Space,3
Eat only bugs the rest of your life,0,Eat only partially decomposed flesh the rest of your life.,0
Lose your wife,0,Lose your mother,0
Be with the most beautiful ripped man?,1,Be with the ugliest fattest woman?,0
Eat a bowl of maggots.,0,Eat a bowl of worms.,0
Eat a bowl of maggots.,0,Eat a bowl of worms.,1
"Take complete control over their internet web sites (facebook, twitter, etc.) and they can never tell anyone.",2,Lock them in a room and make them listen to Justin Bieber for 72 hours straight,0
"Take complete control over their internet web sites (facebook, twitter, etc.) and they can never tell anyone.",4,Lock them in a room and make them listen to Justin Bieber for 72 hours straight,0
"Take complete control over their internet web sites (facebook, twitter, etc.) and they can never tell anyone.",1,Lock them in a room and make them listen to Justin Bieber for 72 hours straight,0
Be incredibly good looking with a small package,2,Be ugly with a large package,1
Jwoww,0,Sammi,0
Only be able to ask questions,0,Only be able to answear questions,1
Only have the senses of sight and sound,1,Not be able to feel any emotions,0
Find a colony of spiders in your nose,0,Suck a trannies dick until it finishes,0
Pull a 5 foot cactus out of your urethra,0,Pull a 10 foot cactus out of your anus,0
Be run over by a steam roller,3,Be chewed up by a wood chipper,1
Live,1,Die,1
The Blue pill,0,The Red pill,4
Be deaf in one ear,0,Be blind in one eye,2
"Have your skin slowly peeled off, inch by inch",2,Slide down a slide made of razor blades into a pool of acid,4
Eat poop,2,Drink pee,10
Be in a constant state of orgasm,1,Be in a constant state of laughter,0
Have a child every 2-3 years starting at 16 until unable to conceive ,0,Have 4 children with 4 men/women ,0
Have a sexual obsession with a disembodied head,0,Have a sexual obsession with your sibling,1
4 year old son,2,4 year old daughter,1
Cast of Jersey Shore,1,Justin Beiber,2
Have balls of steel,1,Have huge goat balls,0
Have arm pit hair 2 feet long that you can never shave,0,Or fingernails 3 inches long that you can never clip,0
Blue,0,Red,0
Get stabed by a knife in a fight,0,Get shot in a fight by a gun,0
Darth Vader,0,Adolf Hitler,1
Michael Jackson,1,Elvis Presley,1
Be with somebody who breath smell like boo boo forever ,0,Be with someone with bad body oder forever,0
Blu Team,1,Red Team,1
To become any Pokemon of your choosing ,0,Pokemon Trainer,0
Have the face of Sarah Jessica Parker and be accepted.,0,Be a Centaur and be isolated from the world.,1
"Have every super physical ability (strength, speed, enducance, ect) ",1,"Have every super mental ability (telekinesis, flight, read minds, ect) ",4
Date Selena Gomez,0,Date Bella Thorne,0
Play Zombies(Black Ops),0,Play Survival Mode(MW3),0
Thirst,0,Hunger,2
Get shot in the leg once ,1,Eat your poop every week ,0
Publish your diary,0,Make a movie of your most embarrassing moment,0
Not be able to fap,2,Suck your dad's p***S,0
Sum 41,0,Blink-182,1
Iron Man,1,Batman,1
Blink-182,0,Sum 41,0
Only drink water for the rest of your life,1,Be able to drink anything besides water,4
The Justice League,1,The Avengers,0
Hoodie Allen,1,Mac Miller,0
Charmander,1,Squirtle ,2
Charmander,0,Squirtle ,1
Watch your parents have sex for the rest of your life,0,Join in on them for a threesome and never have to see them having sex again,0
"Be able to freeze, slow, accelerate or reverse time",0,Be able to manipulate the elements,1
Listen to Skrillex,2,Listen to Justin Bieber,3
Have Morgan Freeman's Voice,2,Have Sean Connery's Voice,0
"Have the power to get back to life everytime you die, but you die with a lot of pain ",0,Let someone you may it may not know randomly die once a month ,0
Get $1.000.000 dollars ,0,Have 20000 people who don't have anything die.,0
Murder 3 people ,0,Eat your poop once every month ,0
FC Barcelona,0,Real Madrid,0
Manchester City,0,Manchester United,0
Be a boss at math,1,Be a boss in foreign language. ,0
Be a boss at math,0,Be a boss in foreign language. ,0
Eat a bug,1,Eat a dog ,0
Have a million dollars but not able to spend it,0,Have a million dollars and give it all to a little kid who spends it all on candy and gets very fat,0
Read minds ,2,Live forever,2
Listen to Wiz Khalifa,0,Listen to Lil' Wayne,0
Pick blue,4,Pick red,0
Punch 3 baby three times in the face every week,0,Give a deadly disease to 10 different people every 6 months,0
"Have a robot constantly following you, taking pictures of everything you do",0,Have a tumbleweed constantly following you,0
"Your best friend have an affair with your parent,",0,Your best friend have an affair with your significant other.,1
Feed pie through your pee hole,0,Feed pie through your butt hole,0
Feed pie through your pee hole,1,Feed pie through your butt hole,0
Have the power to stop time,0,Have the ability to become invisible,5
Have a supply of green 1up mushrooms,0,Or a supply of red and blue mushrooms,0
Lose all memory of your past,0,Not be able to make new memories in the future,0
Meet the tenth doctor (aka David Tennant),0,Meet the eleventh doctor (aka Matt Smith),1
Only be able to watch Studio Ghibli films for the rest of your life,1,Only be able to watch Disney films for the rest of your life,1
Left,0,Right,0
Be a mega rich nerd with no social connections,0,Be attractive and cool but not rich,0
4chan,1,Reddit,0
Rub oil on your nipples and chase a midget,2,Get raped by a russian,0
Rub oil on your nipples and chase a midget,0,Get raped by a russian,1
Christina Aguilera,0,Britney Spears,0
Get into a fist fight with Batman,2,Get into a fist fight with Spiderman,0
Get into a fist fight with Batman,0,Get into a fist fight with Spiderman,1
Have Batman's immense wealth,1,Have Superman's immense strength ,1
Taste everything you smell,0,Taste everything you touch,0
Ass,0,Tits,0
Bring The Notorious B.I.G. back to life,42,Bring Tupac back to life,32
You can only keep your eyes open for 1 hour a day,1,You can only hear for 1 hour a day,1
Be a character from Naruto ,6,Be a character from Bleach,0
Invisibility,0,Be able to fly,0
Lose i toe nail,0,Lose a finger nail,0
Get steped on by a giant ,0,Get shot by a be be gun 10 times in the legs,0
The Lord Of The Rings films,1,The Star Wars films,0
Have ten bees fly up your nose,0,Swallow ten live wasp,0
Have your fingers become hotdogs forever,367941,Have your tears be relatively acidic,743562
It be a Delorean,494356,It be a telephone booth,578862
Wrestle with a bear. ,9,Step on a Lego.,21
Marry one of the hillbilly monsters from Wrong Turn ,0,Spoon with Robert Pattinson(Guys)/Snooki(Girls),0
Be White,1,Be Black,1
Sleep in 10 gallons of sperm every night for the rest of your life,0,Never be able to masturbate or have sex ever again,0
Look like Frankenstien,4,Look like Beavus (From Beavus and Butt Head),0
Be like Jet,0,Be like Alex,0
Eat blue cheese,0,Be a mexican,0
Drink Goat milk raw for the rest if your life,0,Drink your own pee for a whole day,3
Drink Goat milk raw for the rest if your life,0,Drink your own pee for a whole day,2
Blue,0,Red,1
Be in 3 relationships that lasted for 4 months each,1,Be in a relationship with one person for a year,0
Jump off a 1000 foot cliff into water ,2,Jump of a 10 foot cliff into lava,0
Have your legs shredded by a bear 4 different times,1,Watch your mother be killed by a bear,1
Burn to death and go to heaven,0,Watch your loved one get burned to death and come back to life in 50 years,0
Be a Boss,0,Be a G,0
Burn to death,0,"Be beaten within an inch of your life every week for 6 months, but survive",1
Be a Peanut,0,Be a Pistachio,0
Be a guy with female parts ,0,Be a girl with male parts,0
Be chocolate,0,Be a sugary treat,0
Be homosexual,0,Your wife is Homosexual,1
Eat a dog,1,Eat a cat,0
Be homosexual,0,Never be loved,0
Die alone ,0,Die with people who hate you,0
Die of natural causes in a 5 foot deep hole,3,Die from falling into a 5 foot deep hole,2
Blue,5,Red,2
Never wath another movie,3,Never listen to another song,1
Boy ,2,Girl,0
Be a woman,0,Be a man,0
Be a baby for the rest of your life,2,Be old for the rest of your life,0
Never age from the time you turn 18,0,Never feel pain or sickness,0
Women are smarter,0,Men are smarter,0
Have really good looks,0,Have bad looks but have any guy or girl you want,3
Use Dreamweaver,0,Use Wordpress,0
Use Facebook,2,Use Google plus,4
Salt,1,Pepper,0
Watch Adam Sandler,1,Watch Eddie Murphy,0
Nonstop laugh for your entire life,2,Nonstop cry for your entire life,0
Watch Tom Cruise,0,Watch Will Smith,1
Slide down a never ending slide,3,Freefall for the rest of your life,1
Bathe a cat,1,Attack a rotwieler,1
Be Gimli,0,Be Pipin,1
Laugh with the sinners,0,Cry with the saints,0
Always sneeze in an akward moment,1,Always cough in an akward moment,3
Watch woody's gamertag,0,Watch xKapowned,0
Rap battle jesus,0,Rap battle eminem,0
Eat a puppy,0,Punch a pregnant woman in the belly,2
Have fingers the length of legs,3,Have legs the length of fingers,1
Burn to death,3,Get buried alive,0
Go fishing,0,Go skatebording,0
Die having fun,6,Die boreingley,0
Die having fun,0,Die boreingley,0
Die having fun,3,Die boreingley,0
Die having fun,1,Die boreingley,0
Die having fun,5,Die boreingley,0
Die having fun,7,Die boreingley,1
Die having fun,1,Die boreingley,5
Die having fun,1,Die boreingley,1
Die having fun,2,Die boreingley,0
Die having fun,2,Die boreingley,1
Have a naked mole rat,2,Have a naked dog,0
Get stapled 10 times a day,0,Get stabbed by a two inch blade once a month,1
Work,4,Bang on the drum all day,1
Eat a 3 musketeers,2,Eat a milky way,1
Go back in time and stop Adolf Hitler,0,Go back in time and stop the KKK(Ku Klux Klan) from forming,0
Go back in time and stop Adolf Hitler,7,Go back in time and stop the KKK(Ku Klux Klan) from forming,6
Go back in time and stop Adolf Hitler,2,Go back in time and stop the KKK(Ku Klux Klan) from forming,1
Nsync,0,Backstreet boys,0
Be Hispanic,0,Be Black,1
Drink only dr. pepper for the rest of your life,0,Drink only root beer,2
Drink only dr. pepper for the rest of your life,0,Drink only root beer,0
Play video games a lot and have an average IQ,1,Read books and be the smartest person in town,0
Cut off your Penis,0,Live with no arms or legs,1
Watch Cbeebies for a year,0,Watch the Disney channel for the rest of your life,0
Watch Cbeebies for a year,0,Watch the Disney channel for the rest of your life,3
Watch Cbeebies for a year,2,Watch the Disney channel for the rest of your life,0
Blue Pill?,1,Red Pill?,0
14 yr old son walk in on you masturbating ,4,14 yr old daughter walk in on you masturbating ,0
Have nipples that look like diamonds,0,Have nipples that changed colors (like disco lights),2
Have nipples that look like diamonds,0,Have nipples that changed colors (like disco lights),7
Facebook,1,Twitter,0
"Have your face on a bill board in new york city, for an advertisement for condoms",0,Having your name tattooed on your forehead. ,0
Accidentally slam your hand down on a telephone message spike ,0,Get the tips of your fingers caught in a paper shredder.,0
Have a sex change,2,Change sexual preference ,0
Choose to see your future (without being able to change it),0,Know everyone else's future and not be able to tell them? ,1
Be a Guy,0,Be a girl,0
Kick a wall with a tooth pick under your toe nail,0,Get your head stomped on while biting the side walk.,0
Live in a Slum,1,Live in a poor african location,1
Live in a Slum,1,Live in a poor african location,0
Fuck megan good five times ,0,Fuck everyday ,0
Have sex with rihannah,1,Have sex with beyonce,0
Live forever but be homeless for eternity,1,Live for 20 years and be rich,1
Have all DC Comics,0,Have all Marve Comics,0
Stab a baby quickly,1,Get stabbed slowly and painfully,0
Have a bunch of friends that secretly hate you,0,Because friendless loser,1
Be smarter than everyone but called a wierdo by everyone,3,Be dumb but cool with everyone else,1
Be smarter than everyone but called a wierdo by everyone,3,Be dumb but cool with everyone else,3
Be shot in the kneecap,1,Have your tongue cut off,0
Have 100 Justin Biebers,0,Have Osama come back to life and cause another 9/11,1
Lose your lips,1,Lose your tougue,2
Have no one come to your wedding,0,Have no one come to your funeral,1
Experience a Category 5 Hurricane Everyday ,1,Experience 2000 ft Tsunamis Everyday,0
Be fat and find true love ,1,Be sexy but never find true love,2
Be fat and find true love ,0,Be sexy but never find true love,0
Be fat and find true love ,1,Be sexy but never find true love,1
Be fat and find true love ,0,Be sexy but never find true love,1
Be fat and find true love ,1,Be sexy but never find true love,0
Write an important research paper on a subject you are not good,1,Take 4 somewhat hard math tests per day for 4 days,1
Give a rim job to a dog ,0,Get punched in the face everyday by brock lesnar for 5 months,0
Fight Bill Clinton.,0,Fight Barack Obama.,3
Be CJ from Grand Theft Auto: San Andreas,9,Be Tommy Vercetti from Grand Theft Auto: Vice City,13
Lick a hobo's foot,1,Make out with an elephant,0
Fuck a chimpanzee,0,Suck a horse's dick,0
Get stabbed in the kneecap,0,Get stabbed in the abdomen,0
Be completely ignored by everyone?,0,Have everyone not leave you alone?,1
Get stabbed in the kneecap?,0,Get stabbed in the tongue?,1
Go on the computer?,3,Watch TV?,0
Be smelling like pee?,0,Be smelling like poop?,0
Have Your Dream House,0,Have Your Dream Girl,4
Have Your Dream House,0,Have The Perfect Significant Other,0
Go blind,2,Go deaf,1
Have sex with 3 super modles and no one know,1,Be stood up by 3 super modles but everyone think you had sex with them,0
Slam Your Penis In A Door,0,Have Sex With Your Own Grandmother,0
Eliminate North Korea,2,Eliminate Al Qaeda,0
Have 14 testicles,1,One testicle the size of a coconut,0
Sex with megan fox,1,Sex with jessica alba,2
Attach you hand to your elbow in place of your arm,0,Attach your foot to your knee in place of your leg,0
Kiss Rosie O'donnell,0,Brad Pitt,0
Kiss Rosie O'donnell,9,Brad Pitt,7
Shoot youreself in the leg ,1,Cut of a arm,0
Have a 1911,0, glock,3
Be a girl without periods or pregnancy,1,Be a regular man,0
Would you rather swim in somebody else's snot,0,Or drink a strangers piss through your nose,1
Be a single virgin for the rest of your life but with heaps of friends and money,1,Have an extremely attractive girlfriend who nobody likes and be poor,0
Be a Billionaire,1,Cure cancer,0
Be a Billionaire,5,Cure cancer,0
Be a Billionaire,0,Cure cancer,0
Take a test you know about all-day,2,Take a test you don't know about for half a day,0
Be raped by a horse for two hours,0,Or get tentacled by an octopus in the butt,0
Be able to fly?,0,Be able to turn invisible?,0
Drink nothing but Kool-Aid for the rest of your life,1,Eat nothing but corn dogs for the rest of your life,3
Live forever,0,Have the person you love the most live forever,0
Live forever,1,Have the person you love the most live forever,0
Say What The Fuck in every sentence,5,Say Son Of A Bitch in every sentence,0
Sdgfsdgf,1,Gfdsgf,5
Die in 5 seconds,0,Die in 5 minutes,1
Have the perfect face with a terrible body,0,Have the perfect body with a very ugly face,1
Own Ferrari the company,3,Own Lamborghini,2
Only be capable to taste sweet stuff,0,Only be capable to taste spicy stuff,0
Never get tired,1,Never get hungry,1
Give someone anal,1,Recieve anal from someone,0
Live without music ,1,Live without the internet,0
Work as a head manager at Outback Steakhouse,0,Work as a lower level assistant associate at a marketing/advirtising firm,1
Play YouRather for the rest of your life every minute,1,Play Tetris for the rest of your life every minutes,1
Skyrim ,1,Modern Warfare 3,0
Not be able to listen to music,1,Not be able to watch movies,0
Have an intimate relationship with anyone in the world for 48 hours,24,Have an endless supply of hot breadsticks with any dipping sauce for the rest of your life,22
Choose surgery that may be fatal ,0,Live it up for a month,0
Kill five kids to save 100,1,Let five live knowing 100 will die,2
Go to the future ,1,Go to the past,0
Be Buried Alive,1,Jump Off The Empire State Building,1
Be Buried Alive,0,Jump Off The Empire State Building,8
Be able to tell everyone everything but have no one believe you,3,Have everyone believe what you say but you can talk about only one topic,1
Have amazing ideas but be unable to write them down,1,Have just normal ideas,0
Lick the foot of a homeless man with full tongue contact from heel to toe,0,Lick a 48 inch spread of concrete outside of Wrigley Field with full tongue contact,0
Have no friends ,0,Have no family,1
Locked in a room with Ann Coulter for the rest of your life.,0,Locked in a room with Bristol Palin for the rest of your life.,0
Eat Cookie Cake ,2,Ice Cream Cake,0
Watch Reno 911,1,South Park,1
Have a lightsaber (star wars),0,Have a wand (harry potter),0
Date your dream girl/guy,0,Be very rich,0
Would you kill an Asian?,0,Kill a Hispanic person?,0
Run 3000 meters,2,Run the 200 meters without your feet?,1
Drink a cup of mucus,0,Eat a cup of skin flakes,1
Be ugly but believe you are beautiful,0,Be beautiful but believe you are ugly,0
Have hands that are cat paws,0,Have hands that are duck feet,1
Watch porn with your parents ,0,Watch porn of your parents ,1
Live with you parents the rest of your life ,0,Live with four of your siblings the rest of you life,2
Pokemon be real.,1,My Little Pony: Friendship is Magic be real.,0
Shoot your self with an gun,1,Jump out of the window,0
Have testicles the size of mangoes,0,"Take a cheese grater, and slowly grate your erection",0
Have An Xbox 360,1,Have A PS3,4
One of your grandparents friends,0,Cameron Diaz after being dead for 10 minutes,1
Yes!,0,No!,0
The Beatles,1,Pink Floyd,1
Eat a pile of shit ,0,Or eat human testicals,0
Black,0,White,3
Be bald ,1,Always think your going bald,0
Huge penis and broke ,0,A smaller than average penis but rich,0
Be in the Cult of Cthulhu.,0,Be a member of the Westboro Baptist Church.,0
Get a full sex change,0,Be homosexual forever,0
Drink a glass of sweat,1,Drink a glass of saliva,0
Bring back Hitler and have him live forever,1,Create the Joker and have him reign terror on your city/town for your lifetime,1
Cristiano Ronaldo,0,Lionel Messi,1
"Kill your family(Mother, Father, Sister, Brother.......)",0,"Kill your family(Wife/Husband, kids)",0
Have friends that act like they are your friend but hate you ,0,Have no friends at all,0
Not be able to talk,0,Not be able to see,0
Not be able to talk,5,Not be able to see,0
Freeze Time,1,Super Speed,0
Freeze Time,0,Super Speed,0
Freeze Time,0,Super Speed,1
Eminem,2,Drake,0
Have Curly/ Wavy Hair,0,Have straight hair,1
Have a pet Cheater,0,Have a pet Wolf,2
Eat shit with salt,0,Eat camel dick with ketchup,1
Be anorexic,0,Be bulimic,0
Lose the sense of sight and smell.,0,Lose the sense of touch and sound.,0
Lose the sense of sight and smell.,1,Lose the sense of touch and sound.,1
Be tortured (Glasgow Smile),0,"Date the person who you have the biggest crush on, fall completely in love with them, and then be thrown away, as if the whole thing was nothing.",0
"Always be considered sexy, but never get laid.",0,"Always be considered smart, but never use your intelligence to good use.",0
"Eat the most delicious lobster you EVER had in your life, knowing that you'll get diarrhea later",0,"Eat lobster that's just average - not bad, but nothing special",1
"Eat the most delicious lobster you EVER had in your life, knowing that you'll get diarrhea later",3,"Eat lobster that's just average - not bad, but nothing special",1
Be really wise and spread your wisdom to others,1,Be really smart and able to spread what you know (book smarts not wisdom) to ohers,0
Watch your parents have sex everyday for three years,1,Join in one time,1
Be Pepper Sprayed For 5 Minutes Consistantly ,0,Be Tazered In The Back Once With A Police Tazer,4
Eat shit with salt ,0,Eat camel dick with ketchup.,1
Get punched in the face by Mike Tyson with no Glove,0,Get kicked in the face by Christiano Ronaldo ,8
Think out loud,0,Hear other every insult (toward you) no matter what form its in,0
Be a successful gay porn actor,2,Film 2 girls and 1 cup and clean up afterwards,0
Do a split for the rest of your life with a knife in your butt and a bullet through your head,0,Be a cat,3
Fart Classical Music,20,Burp Opera Music,27
Play Modern Warfare 3,2,Play Battlefield 3 ,1
Fight Brock Lesnar in a UFC ring,1,Fight Mike Tyson in a boxing ring,3
Play Call of duty ,0,Play Battlefield,3
Win the lottery,4,DIe by a car accident,1
Yes!,1,No!,0
Be a stay at home mom or dad,3,Work an average 9-5 job,1
Be eaten by thousands of small spiders,0,Be eaten by one giant spider,0
Die because of a spoon filled with hair and shit,0,Be a sperm,0
Be a pirate,0,Be a ninja,0
Anal,2,Shit,0
Be a ninja,3,Be a samurai,0
Be a madhjsfkjashfjshdavhjvchjkduhbwvjhgvcskudabelkrvblsadjhbv labehljafhdbvdfsljbvkfjzbhgjdhzbvdafkubhgkaudg,0,Ksadhfvkuahrvfukqwevfouqywgefouweyvfouyrvkugarvfajvrfjqwfrvqjwehvfkuqwhfvuk A be,1
Blue Option,5,Red Option,2
Blue Option,1,Red Option,1
Have sex with Sarah Jessica parker,1,Have sex with a horse,0
Be a bowl of cereal,0,Be a bowl of soup,1
Independance day ,0,World war II,3
Hunt with a gun,0,Hunt with a bow and 3 dozen arrows,0
Be a bird with a broken wing ,1,Be a defenseless baby zebra with a broken leg in a tiger exhibit at the zoo,0
Know all secrets of the USA ,3,Know all secrets of China,0
Live,2,Die,8
Eat 50kg Butter,0,Never eat Butter again,1
Know Charlie Sheen,1,Know Megan Fox,2
Go on Reddit,2,Go on 9gag,0
Be a dog,3,Be a cat,0
Watch your parents have sex for 90 days in a row,21,Join in for one time,5
Have Poison Ivy In Your Butthole For A Week ,0,Have Athletes Foot For 2 Months,3
Eat boogers ypur whole life,0,Eat slimey slugs,0
Wipe his butt after he was done,0,Just walk away,1
Perform eye surgery on yourself with a butter knife ,0,Perform surgery on your testicles with a steak knife,0
Be Tiger,3,Be a Bear,0
Be Adolfo Hitler,34,Be Joseph Stalin,34
Be Adolf Hitler,0,Be Joseph Stalin,1
Be a fish,0,Be a bird,1
Have an teacher that isn't great,0,Have a really big test every day,0
Remain under the rubble,1,Jump out of the window,0
Go Scuba diving ,0,Go Sky diving ,8
Commit suicide,0,Be murdered,4
Commit suicide,0,Be murdered,0
Commit suicide,0,Be murdered,1
Commit suicide,0,Be murdered,2
Commit suicide,1,Be murdered,0
Commit suicide,1,Be murdered,1
Work for an abusive boss for lots of money,0,Work for a nice job for hardly any money,0
Go to the future,1,Go to the past,0
Own an iPhone,1,Own an Android,0
Eat 100 cockroaches,1,Drink 100ml of sweat,0
Eat 100 cockroaches,0,Drink 100ml of sweat,0
Be a leader among few,3,Be a follower of the great,2
Be Sonic the Hedgehog,2,Mario,0
"Play the ""Mario kart"" series",0,Play the Modnation Racers series,0
Drink pee,0,Drink blood,1
Only wipe your butt,0,Only brush your teeth,0
Tell them everything ,2,Go through with the torture,0
The Alien,0,The Predator,0
Be naked and mummified alive by your boyfriend/grilfriend,0,Be raped.,1
Eat all of a homeless person's dandruff,1,Eat 5 of a homeless person's toenails,0
To Eat,0,To Sleep,0
Kill yourself,1,Be murdered by your friends and family,0
Be remembered for something bad,0,Be forgotton,1
Drink a gallon of seawater,0,Drink a gallon of fresh toilet water,1
Choose this option,2,Choose this option,0
Never have sex?,3,Never be in love or get married?,0
Dudley Puppy,0,Kitty Katswell,0
Blue Team,1,Red Team,2
Be Sonic the Hedgehog,1,Be Mario,1
Be a Tiny Rhino,1,Be a Giant Hamster,0
