option_a,votes_a,option_b,votes_b
Be painted by Van Gogh,462554,Be painted by Da Vinci,1121946
Run 26 miles,915383,Swim 5 miles,901412
Your partner have a homosexual affair,985582,Your partner have a heterosexual affair ,675683
Have a Pepsi,637479,Have a Coke,1184397
Watch only dramas for the rest of your life,254102,Watch only comedies for the rest of your life,1510175
Burn to death,554364,Drown ,1210010
Have two penises,139478,Have four testicles,75814
Watch your favorite movie on repeat for a full day,1282970,Watch Nick and Norah's Infinite Playlist once,381582
Live until 80 in poverty,596519,Live until 40 in riches,1137460
Be stabbed in the stomach 10 times,774447,Be shot in both kneecaps,937709
Be Wilma Flintstone,449804,Be Velma from the Scooby Doo mystery gang,1161315
Have no tongue,654548,Have no teeth,1099200
Be John Lennon,824444,Be Paul McCartney,742530
Be famous in this lifetime,927666,Go down in the history books,838798
Be topless all the time,815783,Be pantless all the time,261688
Lose your preferred hand,522469,Lose your preferred foot,1180299
Dance like Michael Jackson,1026161,Sing like Freddie Mercury,711077
Have a stomach ache,838865,Have a headache,905985
Give a speech to the whole nation,1587826,Have to sleep with tarantulas on your bed,163392
Be a centaur,908274,Be a mermaid/man,803403
Have a child in 7th grade and raise it,885881,Never have kids/adopt,838974
Have to sleep 3 hours everyday,899633,Have to sleep 15 hours everyday,877992
Snort one crushed up Altoid Mint (spearmint) ,574004,Take a shot (1.5 oz.) of Tabasco Sauce,1004766
Be a cat,666570,Be a dog,1147259
Be deaf and have no legs,1327916,Be blind and have no arms,325204
Be in jail for a year,570781,Live in complete isolation in the mountains for a year,1187173
String your opponent along for the entire fight,410697,Crush them from the beginning,1199516
Speak every language except the language of the country you're currently in,597685,"Speak only the language of the country you're in, but know the meaning of every single word in that language",1084849
Have your hands switched for Dustpans,365300,Be sweating jam instead of sweat,1212442
Have no hands,496086,Have a naked fat guy stalking you at all times,1250802
Be Chev Chelios from Crank,205025,Be The Transporter,1123960
Fight Jackie Chan,1090913,Fight Jet Li,544593
Be Batman,955933,Be Superman,832867
Be telekinetic,931031,Be telepathic,769343
Always be hot,764460,Always be cold,1001650
Be a prostitute,115781,Only have sex with prostitutes,155030
Be horribly and hopelessly depressed,629126,Have inescapable overwhelming anxiety,907854
Become a superhero,1290573,Become a supervillian,465102
Be hung by a noose,471172,Be decapitated by a guillotine,1098765
Have two sets of twins,1301104,Quadruplets,382318
Lose your front teeth in a skateboarding accident,512207,Break your hands on a bike,1162888
Live in Boston,450306,Live in New York City,1250897
See how or what created civilization,774736,See how or what ends civilization ,915932
Eat Lay's Potato Chips,551588,Eat Pringles,1179774
Be into beastilality,151805,Be a necrophiliac,89101
Drink hard liquor,124608,Drink beer,142120
Live without your cell phone,395985,Live without your iPod,1354059
Be a rock star,548073,Be a movie star,1194911
Kick your grandmother in the ovaries,127650,Lick your grandfathers belly button,128611
Be infertile,1341903,Have a child that passes away before age 5,312276
Steal an elderly woman's purse,885347,Tell 10 orphans that Christmas is cancelled,805068
Have loved and lost,1217965,Never loved at all,468285
Eat fruit,1531854,Eat vegetables,211759
Be the first killed in a group,852748,Be the last killed in a group,874734
Bang 3 midgets simultaneously,225775,Bang an 800 pound partner,42452
Spend a year alone in a deep sea submarine,525993,Spend a year alone in a space station,1171727
Make out with your cousin,1082180,"Wear cutoff shorts your whole life, never taking them off",573487
Have hair covering your entire body,439627,Be completely bald,1228492
Have 50% of your body burned,572516,100% of your body tattooed,1136141
Shotgun a beer,1001680,Funnel a beer,513217
Have sex only once in your life with the sexiest person alive?,151494,Have sex many times with ugly people for the rest of your life?,116480
Be blind,643316,Be dumb,1076553
Punch a pilgrim,664044,Eat an avocado,1005257
Be black in a white neighborhood,1171215,Be white in a black neighborhood,542294
Be Matt Damon,967943,Be Ben Affleck,531821
Be able to only speak in lolspeak,676106,Be able to only type in 1337 speak ,781587
Drive 200 miles well over the legal drunken limit,623673,Drive 200 miles after being awake for 72 hours straight,974629
Only be able to laugh at blonde jokes,1080035,Not be able to understand sarcasm,569231
Die from hypothermia (cold),1174666,Die from hyperthermia (heat),480848
Be a contestant on Wheel of Fortune,1144756,Be a contestant on Jeopardy,401400
Hook up with an ugly person in the privacy of your own room,87591,Hook up with a beautiful person as 20 of your friends and family watch,181533
Save Abraham Lincoln ,880150,Save J.F.K,763389
Stop showering,602474,Stop brushing your teeth.,1067530
Get breast implants,144778,Get butt implants,120491
Live an average life and be forgotten in time,1123889,Go down in history for something terrible,520519
Travel the world confined to a wheelchair,882646,Spend your whole life in the same 200 miles radius,741103
Be invincible,968938,Be invisible,776457
Have a high salary in a job you hate,937626,Have a low salary in a job you love,748653
Always tell the truth,1369797,Always lie,336559
Have all fingernails and toenails removed quickly,853588,Deep papercuts on the webbing between each finger and toe slowly,640123
Win the World Series,647286,Win the Superbowl,912762
Not know how to read,423608,Not know how to write,1242524
Spend a day in the Sahara Desert,577282,Spend a day in the North Pole,1079356
Be 4 feet tall,750156,Be 10 feet tall,927078
Be caught at home watching Sex and the City by yourself,391193,Be caught in a bar with a pink martini in hand,551708
Be unable to experience sadness,889443,Be unable to experience anger,783285
Wear high heels,375618,Wear a dress,598836
Stare at the sun for 2 minutes,979355,Drink a liter of scalding water,614929
Go to heaven or hell,690588,Be reborn into a better/worse life,961052
No alcohol at all for the rest of your life,189663,Drink grain alcohol only,79121
Raise a family with Samuel L. Jackson,670105,Raise a family with Vin Diesel,827448
Only be able to laugh at violently racist jokes,840633,Only be able to laugh at intricate Star Trek jokes ,757222
Have a giant birthmark covering 78% of your face,329837,Have a two foot tail,1310435
Watch The Sandlot,648971,Watch The Goonies,742361
Not be able to taste,397079,Not be able to smell,1267099
Get an Atomic Wedgie,840608,Get a Swirly ,599809
Live in a treehouse,972942,Live in a floating boathouse,688742
Have paparazzi follow you around,940447,Reveal a different secret about yourself in a weekly newspaper column,628357
Be a genius in a world of unintelligent people,1296892,Be unintelligent in a world of geniuses,351806
Be able to fly,1239539,Be able to breathe underwater,482982
Be credited with the invention of the wheel,219267,Be credited with the invention of the Internet,1398003
Never be able to leave your native country,942712,Never be able to drive,697977
Go throughout your life never once having any sort of sexual experience,154729,Have a horrifying STI,95970
Always be overdressed,1154109,Always be underdressed,498002
Win an Oscar,565363,Win the Nobel Prize,1094926
Be Cinderella,356284,Be Ariel,575922
Only be able to whisper,1178936,Only be able to shout,476924
Be in a car accident that kills only you,1424907,Be responsible for a car accident where you live but your five closest friends and family die,192825
Have a lisp,1006007,Have a lazy eye,547155
Have extreme narcolepsy,688515,Have a bad case of Tourette's,721051
Be a Slytherin,410382,Be a Gryffindor,1116274
"Be attractive, but get punched in the face every morning",1237500,Be ugly,431017
Be the head chef on a luxury cruise liner,626976,Be the head chef in the White House,937802
Get B's and C's at an Ivy League school,443870,Get A's at a standard university,1144330
"Get $20,000 worth of jewelry",625499,"Get $10,000 worth of electronics",1047537
Live in a nudist colony,1206897,Live with the Amish,371070
Live in ancient Greece,1223293,Live in ancient Egypt,390815
Have Pokemon be real,813909,Superheroes exist,875637
Skydive,1223977,Bungie Jump,406476
Be bald everywhere,922616,Be Albino,663433
Wear an eyepatch,1261053,Have a peg leg,329721
Be a nerd,992114,Be a jock,647666
Be an excellent singer,1017578,Be a superb writer,621703
Skittles,872252,M&M's,797880
Have a Monster Truck,916955,Have a chariot with horses,676400
Be an elephant,1053422,Be a mouse,581344
Watch LOST,626954,Watch The Office,889775
Live to be 200 in colonial times,397524,Live a normal lifespan modern day,1136976
Only have sex with the gender you are not attracted to,96096,Be Celibate,155771
Have a lightsaber,1082338,Have a helper monkey,611447
Date Topanga from Boy Meets World,304250,Date Pam from The Office,444418
Have a large painting of yourself,531190,Have a life size sculpture of yourself,1083110
Be Rosa Parks,793955,Be Harriet Tubman,533599
Have a 1st Edition Holographic Charizard,868917,Get $20,732585
Skip Summer,540334,Skip Winter,1130702
Be Gonzo,259136,Be The Cookie Monster,1220285
Be the home maker,391602,Be the bread winner,477979
Be Super Grover,796966,Be Quail Man,394789
Be photographed naked,194194,Be photographed doing hard drugs,79586
Only eat,900302,Only drink,748186
Win the lottery,1082880,Live twice as long,592839
Be a Jedi,1145746,Be a Sith,399568
Get caught cheating,491427,Catch your partner cheating,1088357
Perform petty thievery for a living,522802,Perform grand larceny for a living,840819
Watch Batman (1989),389031,Watch The Dark Knight (2008),1194413
Be a famous rapper,1006964,Be a notorious mobster,554023
Attempt to survive a computer uprising (Terminator),525327,Attempt to survive a zombie outbreak (Dawn of the Dead),995446
Have the ability to teleport,834119,Be able to time travel,821363
Live in the past,476284,Live in the future,1159763
Be allergic to peanut butter,1341197,Be allergic to chocolate,285309
Be a sports star,808826,Be a celebrated academic,746162
Be rich,1297722,Be famous,364681
Be a Vampire,781110,Be a Werewolf,819589
Make one adult video per week,147346,Work a full time job,129901
Always look 8 months pregnant,117355,Always have a black eye,835784
Have knee length hair,851244,Have a 1 foot tall mohawk,693913
Be Emo,674597,Be Gothic,838182
Be attractive and poor,916112,Be ugly and rich,702375
Be loved,1347176,Be feared,291040
Have an uncontrollable itch that attacks at sporradic times,732992,Always have chapped lips,727418
Always be sweating,358390,Always appear shivering cold,1204976
Be known as a drug dealer,894329,Be known as a liar,676870
Be a hawk,1076691,Be a shark,534866
Stop using YouTube,299587,Stop using Facebook,1353005
Fight in the Civil War,646585,Fight in the Revolutionary War,805665
Go on a magic carpet ride with Jasmine,649801,Take Cinderella to the ball,267419
Be Napoleon,573896,Be Julius Caesar,907685
Hang out with Pooh Bear,680350,Hang out with Baloo from the Jungle Book,825462
Eat a five course meal in front of 10 starving children,557222,Steal the bucket from 5 salvation army Santas,945083
Play a game of one on one with Michael Jordan,1050542,Play a game of one on one with Kobe Bryant ,365199
Only speak in questions,442938,Only speak in movie quotes,1147927
Only dance the charleston,595736,Only dance the macarena,814707
Be blackout drunk at your daughter's graduation,77377,Be completely high at your son's wedding,187221
Be called out for stupidity,363329,Admit stupidity,1167240
Only listen to The Beatles,903562,Only listen to The Rolling Stones,575362
Have your blood sucked by a vampire,1378969,Have your brain eaten by a zombie,191859
Be the first person to walk on Mars via a one-way trip,563311,Never travel to space,1002245
"Actually have to laugh out loud every time you type LOL, haha, lmao, etc",803455,Always have to replicate the face of any emoticon you use,733147
Have your elbow joints facing the opposite direction,812355,Have you knees facing backwards.,618473
Be hunted by Jack Bauer,566540,Be hunted by Jason Bourne,716393
Always know when people are lying,922304,Always get away with lying,685934
Be a horse jockey,395582,Be a NASCAR driver,1078257
Eat only human remains for the rest of your life,748151,Starve to death,795765
Play a game of Quidditch,773894,Take a field trip with Ms. Frizzle,675332
Be known as a racist,549218,Be known as a sexist,974147
Be a spouse of a polygamist,606749,Never have a relationship last longer than 2 years,757089
Die on The Hindenburg,628740,Die on The Titanic,845776
Have a British accent,991783,Have an Australian accent,615289
Take the Cinnamon Challenge,853769,Take the Gallon Challenge,579819
Make out with Gollum,332945,Hook up with Beetlejuice (from the movie),417728
Only use Windows,1222595,Only use Macintosh,318486
Speak in only ebonics,477701,Understand no slang whatsoever,890464
Only read romance novels,724654,Only read textbooks,779536
Be a graphic designer,863363,Be an architect,666707
Spend a day with Taylor Swift,770249,Spend a day with Beyonce,770462
Have an incredibly nice car,820375,Own a personal helicopter,770263
Constantly stumble when walking,885807,Constantly studder when speaking,600593
Always have bad hair,1260026,Always have bad teeth,288782
Be a heavy smoker,442611,Be a heavy drinker,1054351
Have amazing sex twice a month,261780,Have bad sex every day,27130
Magically flip genders every year,897477,Be forced to move and start fresh every year,608840
Watch Seinfeld,270767,Watch The Simpsons,1225440
Pee a marble,146570,Poop a football,114608
Wear the same thing every day,435602,Never wear the same clothes twice,1119357
Be sick for the rest of your life,507016,Kill 2 puppies,1056169
Have X-ray Vision,1043342,Have laser vision,536149
Have your face on the $1 bill,580691,Have your face on the $100 bill,1007444
Eat fast food burgers every night,648633,Eat Chinese Take-out every night,899301
Give up Christmas,626463,Give up your birthday,948865
Kill 5 innocent children yourself if it would end all bloodshed in the Middle East for 25 years,872109,"Have ongoing wars, terrorism and fighting in the Middle East",578810
Have extremely muscular arms,1057107,Have extremely muscular legs,486171
Never again play a game on your computer,941518,Never again play a console or portable device game,568118
Be a police officer,997556,Be a firefighter,550838
Be a professional Taser testee,607877,Be a professional beanbag gun testee,773787
Chug a pint of ocean salt water,1099377,Chug a pint of rancid milk,307134
Play Goldeneye (N64),463805,Play Halo (Xbox),972194
Go toe to toe with Michael Myers,766133,Try to take down Freddie Kruger,578900
Catch your best male friend sleeping with your mom,300309,Catch your best male friend sleeping with your sister,1175977
Be married to a morbidly obese and ugly person who is incredibly wealthy,323494,Be married to a georgous person who is on welfare,1136045
Have holes put through both hands and both feet via nails and a hammer,625990,Go for 40 days in the desert without food,773144
Live in the Star Wars universe,1246075,Live in the Star Trek universe,220340
Have no family,565416,Have no friends,978471
Only listen to bagpipe music,445833,Only listen to banjo music,1117725
Inform a room of children that their pets are dead,87390,Explain sex to a room full of children in graphic detail,175468
Marry at age ten,824058,Never marry at all,734104
Have the voice of PeeWee Herman and dress perfectly,357009,Have the voice of Morgan Freeman and dress terribly,1057668
Always Run,1372011,Always Crawl ,177988
Death by electric chair,379082,Death by lethal injection,1127721
Yell a swear between every word,604880,Get punched in the face after every swear,894384
Wrestle an alligator,895308,Wrestle a bear,593485
Sleep in your parent's bed every night,765549,Weep every time someone tells a joke in front of you.,696483
Discover the Loch Ness Monster,898996,Discover Sasquatch ,574541
Watch Are You Afraid of The Dark?,575115,Read Goosebumps,811293
Be on GUTS,308619,Be on Legends of the Hidden Temple,818496
Give up buttons and zippers,401071,Give up velcro and knots,1041873
Always be late,1246241,Always be unprepared,274828
Always wear a top hat,1026260,Always wear a giant clock necklace,462285
Never be able to compliment,346847,Never be able to complain,1152918
Kill one person you know,545660,Kill three strangers,983670
"Rape someone, like it, go to jail for a long time, and regret it",81474,Be raped,172172
Eat nothing but ketchup for a week,1193160,Eat nothing but mustard for a week,300582
Find a turd in your pillowcase after a nice afternoon nap,138533,Wake up from your nap because someone is peeing on you,106071
Only be able to smoke weed for the rest of your life,124769,Only be able to drink alcohol for the rest of your life,136026
Eat the same thing 3 meals a day for the rest of your life,1093107,Eat whatever you want but have to eat a poop sandwich once a month,366614
Teach history,927524,Teach math,615900
Jump off a two story roof,593263,Take a sandwich tackle from 3 rugby players,830873
Absolutely reek of armpits for the rest of your life,283741,Lose your sense of smell completely,1125037
"Smuggle illegal contraband into the country in your ""bottom""",100944,Have clamps on your nipples for the entire flight,139125
Be paralyzed from the neck down,68933,Have your butt and genitals anatomically switch places,180153
Be killed in a Saw movie,341433,Be killed in a Final Destination movie,1076277
Have your way with Angelina Jolie for one day,77960,Have your way with Jessica Alba for one day,123846
"Stand on red-hot, burning coals for 30 seconds without moving",1180095,Shut your hand in a waffle iron for two minutes,246640
Be a Montague,662524,Be a Capulet,545185
Have grown up without a father,992352,Have grown up without a mother,357599
Be Dr. Zoidberg,821121,Be Kif,437117
Eat a cup of baking soda and then do a shot of vinegar,231330,Eat a pack of Mentos and then chug a Diet Coke,1190300
Have met Jesus,1088261,Have met Confucius,393095
Only drink Starbucks coffee,1061647,Only drink Dunkin Donuts coffee,374217
Be one of King Arthur's Knights of the Round Table,753239,Be one of Robin Hood's Merry Men,616899
Brutally assault a police officer,536489,Brutally assault a well-known gang member,924762
Be molested and raped by an orangutan while tied up in the nude,150,Have to give oral sex to an orangutan ,187
Have uncontrollable Ear Hair,888014,Have uncontrollable Nose Hair,503030
Play Firefight (Halo ODST),707109,Play Horde (Gears of War),523492
Be the opposite sex completely,209215,"Be the same sex but have opposite (functional) ""parts"" south of the border",40325
Be a regular on a daily soap opera,288273,Make one-line cameos in three large Hollywood blockbusters each year,1033500
Have every commercial be an annoying Geico ad for the rest of your life,660258,"Have every commercial be a Verizon ""Can you hear me now?"" ad for the rest of your life",605436
Change your religion,474397,Change your political party,937688
Be a character on LOST,366600,Be a character on Heroes,981486
Be a political figure caught cheating with an underaged boy/girl,75624,Be a sports star caught running underground dog fighting competitions ,163283
Be famous for inventing the Whoopie Cushion,747394,Be famous for inventing snap bracelets,640742
Have no thumbs,910697,Only have thumbs,553153
Have your parents walk in on you having sex,165376,Walk in on your parents having sex,88070
Lose your preferred thumb,816114,Lose the index and middle finger of your preferred hand,530625
Have comically large feet,1184232,Have a comically oversized head,242998
Only speak in haiku,379589,Only speak in song lyrics,1071913
Smell like manure,523255,Smell like urine,825202
Get electrocuted for 10 seconds,521193,Get slapped 20 times,999203
Live in a penthouse in the city,615634,Live in a mansion in the country,853454
Only talk in third person,796437,Never be able to call someone by name,687408
Have narcolepsy,587761,Have chronic insomnia,649073
Always dissappoint people,573124,Always anger people,877160
Be unable to open doors unassisted,679251,Be unable to climb stairs unassisted,738536
Use only Windows ME for the rest of your life,592660,Use only a 16 inch CRT monitor,642313
Start your own business which is doomed to fail,600269,Work for other people at low salaries,787023
Have stretchable legs,345087,Have stretchable arms,1140857
Speak everything in surround sound,216124,Have your own entrance theme when you walk in a room,1231188
Wake up in a bathtub full of ice missing a kidney,481032,Wake up in a public bathroom with a handful of singles and a really lazy eye,859453
Strip on a webcam in front of your entire high school,97773,Get caught making passionate love to a pie,160736
Only eat breakfast cereal,611100,Only eat pasta,885275
Forget who you were,1080799,Forget who everyone you know is,393494
Be godzilla,839087,Be king kong,632839
Only speak in words that begin with H,732279,Not be able to say any words that have the letter E in them,677839
Get $100 today,591067,Get $1 a day for 200 days,946667
Only smell like poop,389370,Only smell poop,1019220
Get married to someone you don't love,505778,"Get married to the love of your life, but you can never have sex with them",922827
Sound like Kermit,1216400,Look like Miss Piggy,195202
Play Beirut (Beerpong),785093,Play Flip-Cup,476417
Have a lover who only speaks on Mondays,1048381,Have a lover who only speaks in Pig Latin,376576
Sneeze every three minutes,863463,Always have the sensation to sneeze and never do,586665
Listen to everything but your favorite musician/artist,618352,Listen to only your favorite musician/artist,800300
Only wear revealing hot pink clothes,657618,Always have to wear socks and sandals,759974
Get gas every time you are around the sex you are attracted to,605976,Burp after every time you kiss,753517
Have no eyebrows,720952,Have a unibrow,752776
Control the emotions of those around you,774381,Control the weather,720792
Be Calvin,672328,Be Hobbes,529765
Live alone on a tropical island,667601,Live with other people in Antarctica ,794983
Date someone who always looks 12,1340760,Date someone who always looks 80,125087
Eat Fruit Roll Ups,816063,Eat Fruit by the Foot,535804
Live in a castle,876637,Own a yacht,620161
Have to end every sentence with a racial epithet,335274,Have to drop two f-bombs in every sentence,1009044
Be the guy from Memento,379977,Be the guy from Groundhog Day,710498
Change your sexual orientation and be famous,570668,Be a heterosexual average person,822428
Be an olympic tennis player,857528,Be an olympic table tennis player,570873
Be homeless,1140250,Be a slave,335312
Constantly have a 40 pound weight on your shoulders,373935,Constantly have 10 pound weights on each of your feet,1016264
Prevent World War II,511289,Win a life changing amount of money in a lottery,969301
Have an un-attractive child,508741,Have a beautiful child with bright blue skin,949028
Be male,997133,Be female,522726
Open a can of whoop-ass on a fool,788910,Pity a fool,543894
Have a really big penis,42503,Be really good at sex,175527
Live in SÃ£o Paulo (Brazil),278465,Live in New York (USA),1154079
Eat only KFC for a month,829158,Eat only Taco Bell for a month,640107
Work 10 hours a day four days a week,906366,Work 8 hours a day five days a week,531009
Run fast,1125787,Jump high,381258
Be hysterically funny,681171,Be absolutely beautiful,802934
Cure cancer,1068985,Make first contact with an alien race,433224
Ride in a hot air balloon,287341,Ride in a hovercraft,1141541
Eat a worm straight from the ground,552857,Snatch a fly out of the air and eat it alive,782255
Have someone pee into your mouth,81578,Have someone poo on your head,171125
Wear only skin tight clothing,593164,Wear clothes that are much too big,840853
Get Swine Flu,806525,Get West Nile,402570
Work for Apple and know all of their secrets,501461,Work for Google and know all their secrets ,975842
Know exactly what happened in Area 51,339059,Accept $1 million,1154319
Eat 50 chicken nuggets,923200,Eat 6 Big Macs,552681
Always be high,185983,Always be drunk,75117
Not be able to feel any pain,1351413,Have extremely brittle bones,98390
Have bright blue hair,1318469,Have bright blue teeth,161362
Know when you will die,643938,Know how you will die,828164
Toilet paper a house,645750,Egg a house,784591
Catch your parents having sex,101581,Have your parents catch you having sex... in their bed,149074
Die when your kid is very young,1028976,Have your kid die before you,364557
Have stinky feet,669710,Have long finger nails,734825
Lose an arm and one foot,613162,Lose a leg and one hand,693226
Always dress like royalty,975133,Always dress like a pimp,457412
Have a personal chef,853501,Have a personal masseuse,583157
Have a penis for a nose,50800,Wipe your bottom with your hand,201740
Drive a bright red Smart Car ,1003338,Be spanked by Rosie O'Donnell every morning,362935
Only drink black coffee,579590,Only eat dry cereal ,854933
"Begin every sentence with ""I'mma let you finish""",579090,"End every sentence with ""...in bed""",782269
Never have sex again,623254,Never learn anything new,776028
Live in an abandoned bomb shelter,631944,Live in an isolated tower,738158
Be known for interrupting Taylor Swift,969819,Be known for smacking Rihanna,446623
Have to get around on all fours all the time,777259,Only make animal noises,557520
"Be close with only one person, and only see them on Sundays",874327,"Know many people and see them every day, but not be particularly close with any",481990
