option_a,votes_a,option_b,votes_b
Watch Epic Meal Time,3,Watch xKapownd,0
Live on earth with people but every single body hates you and wants to kill you ,0,Live on earth alone with absolutely nobody else,2
Have laughter that sounds like fart,0,Have fart that sounds like laughter ,0
Remember every lyric of every song from now on,0,Get $1000 ,1
Be a Jedi,0,Be a Pokémon trainer,1
Have every call of duty ,0,Have every halo,1
Eat unicorns and poop butterflies,1,Fart out unicorns and eat rainbows,2
Eat candy as your only food and drink whatever drink,0,Drink only soda and eat what every you want,0
"Watch a documentary about cells for 18 hours straight and listen, take notes, and not do anything else",3,Not go on the computer for an entire month ,0
"Be absolutley freezing, naked, in antarctica? ",0,Wear a snowsuit in the desert? ,1
Watch all of the Harry Potter movies,0,Watch all of the Twilight series ,0
Be strung by 100 bees at once? ,1,"Eat an ENTIRE live sheep, fur, feet, everything ",2
Laugh whenever something really really sad happens ,1,Go to school/work butt naked ,0
Knock out by mike tyson ,0,Muhammad ali,2
Be John Cena,0,Be Dwayne The Rock Johnson,4
Be Gandalf,1,Be Dumbledore,2
Be loved by somone you dont love,0,Never be loved by the person you love,0
Own apple,3,Own bestbuy,0
Own apple,1,Own bestbuy,2
Eat a onion the size of 3 fists that gives you severe diarrhea ,1,Eat the hottest pepper as big as a fist and couldn't drink a thing,2
Be stuck on a spaceship with an alien from Alien on board.,1,Be stuck in Antarctica with the the Thing running around.,0
See a beloved family meber or friend kill them selfs ,0,See them murdered,1
Watch the first hour of a film,0,Watch the last hour of a film,2
Watch the first hour of a film,0,Watch the last hour of a film,1
Watch the first hour of a film,1,Watch the last hour of a film,1
Watch the first hour of a film,0,Watch the last hour of a film,0
Watch the first hour of a film,30,Watch the last hour of a film,23
Get to round 100 on nazi zombies,0,Or ger to round 1000 and be known as a hacker,0
Eat poo forever,2,Be captured by a terriost ,4
Pepsi,4,Coke,0
Chocolate,0,Vanilla,0
Giraffe,1,Ant,2
Scarlett Johansson,1,Rosie Huntington-Whiteley,0
Jessica Lowndes,3,Evangeline Lilly,1
Be fucked by apes ,0,Fuck the apes,0
Be fucked by apes ,0,Fuck the apes,1
The Big Bang,6,Big Bang,0
Have crazy sword fights all the time,29,Have crazy gun fights all the time,25
One direction:-) ,0,Big time rush,4
Harry styles,0,Niall horran,1
Harry styles,0,Niall horran,0
Have a 1 inch.,0,Have a 15inch.,0
Live with the cast of jersey shore forever,0,Forced to watch every episodes,1
Have a car that can dance,0,Have a dog that can backflip and wears funky shades,4
Live in a world where race absolutely does not matter,28,Live in a world where sexual orientation absolutely does not matter,27
Be able to get the ladies but be fat like Henry VIII,0,Be as intelligent but as ugly as Albert Einstein,0
Be luffy,0,Be naruto,0
Scarlett Johansson,3,Rosie Huntington-Whiteley,0
Give it to your grandma reverse cowgirl in her butt,0,Take it in your butt by your grandpa while handcuffed to the bedposts,0
Always have your finger up your butthole,0,Everytime you breathe you get shot in the face except you don't die,0
Constantly walk in on your younger sister masturbating,0,Have your younger sister constantly walk in on you,0
Have someone slowly split your urethra in half using a large butcher cleaver,0,Have all of your fingers and toes slowly chopped off while having your penis tugged on by a wooly mammoth,0
Would you rather walk in on your parents having sex?,2,Rent a pornographic movie and realize that your parents are in it?,0
Kill your Mom,2,Have sex with Justin Bieber,1
Kill your Mom,1,Have sex with Justin Bieber,2
Kill your Mom,0,Have intercourse with Justin Bieber,4
Kill your Mom,1,Have intercourse with Justin Bieber,0
Kill your Mom,0,Have intercourse with Justin Bieber,0
Kill your Mom,1,Have sex with Justin Bieber,3
Kill your Mom,3,Have intercourse with Justin Bieber,2
Kill your mom,0,Have intercourse with Justin Bieber,0
"Eat a whole, raw bay leaf",0,Down 7 Viagras and 3 cans of Red Bull,2
Spend a day with Bob Dylan,0,Jimi Hendrix,0
Answer this question,0,Quit now and check your Facebook again?,0
Eat a bagel,0,Turn into a jet?,1
Stay how you look now,0,Be infinitely more attractive but have no arms,0
"Wear ONLY the opposite genders underwear (for men bra and panties, or women boxers)-- nothing on top",5,Only wear an adult diaper and plastic pants,0
"Wear ONLY the opposite genders underwear (for men bra and panties, or women boxers)-- nothing on top",0,Only wear an adult diaper and plastic pants,0
"Wear ONLY the opposite genders underwear (for men bra and panties, or women boxers)-- nothing on top",2,Only wear an adult diaper and plastic pants,0
"Wear ONLY the opposite genders underwear (for men bra and panties, or women boxers)-- nothing on top",1,Only wear an adult diaper and plastic pants,3
Be raped by a 20 yr old,2,Rape a 20 yr old,2
Be raped by a 20 yr old,0,Rape a 20 yr old,0
Get mauled by a mama grizzly bear ,1,"Get married, have daily sex with, and have at least 8 kids with someone you hate",1
Oreos with apple juice,0,Chips Ahoy with orange juice,4
Ride a giraffe across,1,Ride a camel across,0
"Invisibility, flying, and telekinesis ",0,Complete control over time,3
Yourself,0,Your boyfriend/girlfriend,4
Yourself,0,Your boyfriend/girlfriend,1
Attack bees,2,Aggressive squirrels,3
(Forced to) Circumcise your children (they can live for anyduration),0,Watch all your children die.,0
Have sex at all hours of the day,3,Never ever have sex,1
"Be married to a rich, horribly ugly, rude man/women",1,Die alone,2
Have anal with your English teacher ,2,Never be able to have kids ,0
Be blue until you die,1,Be red until you die,1
Live in the dragon ball-z universe,2,Live in the naruto universe ,1
Eat your own bugers ,18,Eat a horses poop,0
Kiss justin bieber ,0,Kiss justin timberlake ,2
Kiss justin bieber ,0,Kiss justin timberlake ,0
Kiss justin bieber ,1,Kiss justin timberlake ,0
Chose me,1,Chose me,0
Eat all the carpet in your house,529064,Eat all of the wood and tiles in your house,140374
Take a buckshot to the face.,42389,Take a buckshot to the crotch,23909
Eat your favourite DVD in twenty minutes,242263,Eat one hundred tissues in twenty minutes,417377
Jump forward 10 years of your life,299610,Go back 10 years of your life,423466
Have squirrels for hands,288084,Have guinea pigs for feet,384303
Know who killed Tupac,458455,Know who killed Biggie,178015
Live in Westeros,164062,Live in Middle Earth,458893
Have unprotected missionary Sex with a first cousin,14,Have anal sex with the corpse of an attractive celebrity ,8
Have a roommate with no eyelids,0,Have a roommate with a hideous rash all year long,1
Suck a cow's udder,31872,Have a cow suck your tit,39277
Live in Ancient Greece,366411,Live in Ancient Rome,315898
Lose your keys,483334,Lose your cell phone,240297
Be kissed by the same gender,33,Let him/her suicide instead,12
Anal Sex,0,Oral Sex,0
Have to wear a suit made entirely of fish scales everywhere you go. ,0,Be escorted by a deranged little person named renaldo everywhere you go.,0
Have the powers of Harry Potter,0,Have the powers of a Jedi/Sith,0
Work for Wayne Enterprises,0,Work for Tony Industries,0
Have a pencil stabbed into the hole on the end of your penis.,0,Have a pencil stabbed into your right eye.,0
Be in a desert for 2 years.,0,Be in a snowy place for 3 years.,4
Strapped with dynamite for the rest of your life ,3,Have no hands or feet,0
Born with a third arm,0,Born with a third leg,0
Watch 2 girls 1 cup once a day for the rest of your life,0,Get kicked in the face by a NFL kicker once a day for one week,0
Kill your best freind,1,Die,0
Have everyone in the world answer a would you rather and have it come true,0,"You answer one would you rather question and have it come true, but you would only live for 5 more years.",0
Have a healthy relationship with any celebrity of choice,8,Kill any famous person and get away with it,6
Have a small penis and be a ladies man,1,Have a huge penis and be a 50 year-old Virgin,0
Have both nostrils completely clogged up for the rest of your life.,0,Go completely blind in one eye.,0
Work a minimum wage job for the rest of your life.,0,Live in the wilderness for the rest of your life.,0
Work a minimum wage job for the rest of your life,509263,Live in the wilderness for the rest of your life,588038
Be blind,0,Be deaf,3
Speak in front of 1000 people,0,Be naked in front of 10 people,0
Be a Rock Star,0,Be a Movie Star,0
Never be able to have children,3,Have octoplits,1
Be known as a murderer even though you haven't murdered somebody,0,Lie that you haven't killed somebody even though you have,2
Rape a child,0,Rape a dead person,1
Only say omelette,0,Only watch Teletubbies,0
A giant duck for 10 minutes,0,A battery chicken for 10 minutes,0
Fight a crocodile with a bow,158451,Fight an elephant with a shotgun,261023
Sleep on an amazingly comfortable bed that someone died in,354559,Sleep on a bed of nails,58466
Having sex,180252,Arguing,233975
Kill 10 strangers,4,Kill yourself,0
"Take it yourself, and have to kill your friend",22,"Give it to your friend, and get killed by him/her",26
"Take it yourself, and have to kill your friend",0,"Give it to your friend, and get killed by him/her",0
"Take it yourself, and have to kill your friend",0,"Give it to your friend, and get killed by him/her",1
Be the leader of a big religion,0,Invent something that makes you go down in history for ever,4
"Boston, Celtics",1,"Miami, Heat",1
"Boston, Celtics",0,"Miami, Heat",0
Drink a cup of urine,1,Drink a cup of sweat,0
Drink a cup of urine,0,Drink a cup of sweat,0
Never eat your favorite food ,0,Never drink your favorite beverage,0
Smell poop for the rest of your life,0,Have an ibsane itch on your crotch that never goes away for the rest of your life,0
Have super hairy legs for the rest of ur life,0,Have no Eyelashes and Eyebrows !,0
Weigh 800 pounds and be rich,0,Or weigh 16 pounds and be poor,0
Weigh 800 pounds and be rich,2,Or weigh 16 pounds and be poor,0
Always drive under the speeding limit,224932,Always drive over the speeding limit,173879
Eat poop,1,Drink pee,2
X-box 360,0,Ps3,0
Battlefield 3,0,Modern warfare 3,1
Watch you parents be murdered in front of you.,0,Murder the parents of another family in front of there children who are girls and are ages 4 and 9.,3
Be stuck on a deserted island.,4,Live in a house infested with mice.,1
Be able to see the dead.,4,Be stalked by a ghost everywhere you go.,0
Meet Justin Beiber,0,Meet Kurt Cobain,5
Swap genders but stay the same sexuality,1,Keep your gender but switch to the opposite sexuality,1
Be the smartest person on the planet,1,Be the sexiest person on the planet,3
Have an aftershave which made you the most attractive person on the planet,0,Have a stopwatch which stops time and you can do whatever you want to anybody,2
Listen to One Direction,0,Listen to Justin Bieber,1
Only play beta versions of video games,1,Only watch VHS movies,0
Have the guy/girl you want,4,Lose your bestfriend,0
Accidentally hit a animal and it die,0,Accidentally hit a person but they will just be injured,1
Be a millionaire but always be alone,0,Be a tramp with loads of friends,0
Have sex with a hot girl everyday,0,Have all of the money you can ever imagine,1
Have Freddie Kruger stick his fingers up your bootyhole,4,Have Michael Jackson wank you off to the point where there is no more skin on your penis,0
Have your anus and mouth switch places,0,Have your genetials switch places,0
Have The Power Of Levitation,0,Have The Power Of Flying,1
Jump off a building,0,Drown ,0
Be a Bear ,1,Be a shark ,0
Have boobs grow on your back,3,Be covered in nipples,0
Sleep in a closed coffin,0,Sleep in a crib,0
Be a Pokemon trainer ,3,Be a Pokemon Poacher ,0
Be a Pokemon trainer ,1,Be a Pokemon Poacher ,1
Be blind for a month ,1,Wear no shoes for 4 months,2
Eat shit,0,Eat sourcream,3
Noodle,0,Tree Trunk,1
Noodle,2,Tree Trunk,0
Noodle,3,Tree Trunk,1
Noodle,1,Tree Trunk,0
Noodle,0,Tree Trunk,0
DROWN,6,BURN,1
DROWN,3,BURN,0
Have a Lamborghini,2,Have a Ferrari,0
Panama City Beach,0,Miami,0
Have everything in the world you want but not be able to be or feel happy except for once a month,0,Having only what you need and being happy,3
Feet first into a throttling woodchipper,0,Feet first underneath a steamroller,3
Have a abortion,1,Give birth to the ugliest person on earth,0
"Lose something important every morning for the rest of your life, and spend at least 20 minutes looking for it",0,"Have Chuck Norris, from his prime, come and round house kick you in the balls or equally sensitive place once",0
Be Lebron,0,Be Kobe,0
Be a pro athlete,0,Be an actor,0
Be gay ,0,Be a lesbo,4
Kill someone that meant a lot to you,0,Kill someone who was innocent and had a family to go home to,0
Win a Super Bowl,0,Win a NBA Championship,1
Fight in the UFC,1,Be a Pro Boxer,0
Be forced to wear the clothes of the opposite gender for the rest of the life but no one finds it odd,2,Be the opposite gender but everyone finds it odd,0
Be naked forever ,0,Only own a shirt ,1
Woman with a penis,1,Man with a vagina,1
Always sleep with a Sunlight & can never turn it off,3,Always sleep in complete darkness with screams outside but you cannot cover your ears,1
Kill two of your siblings,1,Kill both of your parents,0
San Francisco,0,New York City,0
Windows 7,4,Mac OS X Lion,0
Have sex with your Aunt,0,Have sex with your Grandmother,0
Face fuck your Aunt,0,Receive oral sex from your Grandmother,0
Face fuck your Aunt,0,Receive oral sex from your Grandmother,1
To be James Hatfield,0,To be dave Mustaine,0
Get a blowjob from your aunt,0,Anally rape your grandmother,0
Be an amazing guitarist,1,Be an amazing pianist,0
Make an unforgetable movie/book,1,To make an unforgetable Song/Album,2
Dolphin,1,A Shark,1
Dolphin,1,A Shark,2
A zombie apocalypse happen,1,The United States get taken over by South Korea,0
Spider-man,0,Batman,2
Live in the country ,1,Live in the city,1
Be Seen Having Sex By Your Parents,2,See Your Parents Having Sex,1
Be trained by Yoda,4,Be trained by Mr Miyagi,0
Be trained by Yoda,3,Be trained by Mr Miyagi,0
An Amish Girl,6,Santa,1
Get shot once a month,1,Get tazed every day ,1
Get shot once a month,0,Get tazed every day ,0
Electricity,0,Water,0
Electricity,1,Water,1
Electricity,6,Water,6
Electricity,0,Water,2
Electricity,1,Water,13
Electricity,0,Water,1
Electricity,0,Water,7
Counter strike,0,Combat arms,0
Pick at a scab,0,Peal sunburn,0
Pick at a scab,3,Peal sunburn,0
Sixty-nine (69),0,Thirty-one (31),0
The man with his face eaten,0,The zombie man,0
Be homosexually raped,0,Get shot nine times,0
Keep your taste,0,Keep your hearing,2
Joey Logano,0,Larry the cable guy,0
Have sex with Miss Fortune,0,Have sex with Gragas,0
Idk,0,Idk,0
Pluck every hair in your body out slowly,0,Share half of every dollar you earn with an annoying neighbor,2
Pluck every hair in your body out slowly,1,Share half of every dollar you earn with an annoying neighbor,0
Pluck every hair in your body out slowly,0,Share half of every dollar you earn with an annoying neighbor,0
Pluck every hair in your body out slowly,1,Share half of every dollar you earn with an annoying neighbor,3
Pluck every hair in your body out slowly,4,Share half of every dollar you earn with an annoying neighbor,0
Pluck every hair in your body out slowly,1,Share half of every dollar you earn with an annoying neighbor,13
Pluck every hair in your body out slowly,0,Share half of every dollar you earn with an annoying neighbor,1
"Have a fancy car and house, but have no money",0,"Have a crappy car and house, but have lots of money",1
To Be Able To Travel Backward In Time,0,To Be Able To Travel Forward In Time.,2
To Be Able To Travel Backward In Time,0,To Be Able To Travel Forward In Time.,0
Being an adopted white kid in a black family,0,Being an adopted black kid in a white family,3
Always walk around with only underwear and a T-shirt,5,Always wear a clown hat,4
Put A Tooth Pick Under Your Toe Nail And Kick A Door Five Times,0,Get Kicked In The Balls Ten Times,1
Put A Tooth Pick Under Your Toe Nail And Kick A Door Five Times,0,Get Kicked In The Balls Ten Times,0
Get slapped in the face by a dick every second for a year...,0,Get anal raped twice a day for two years...,0
Be a student at Hogwarts School of Witchcraft and Wizardry...,0,Learn half of the ways of the force by brutal punishment...,1
Be given a lightsaber,1,"Be given £20,000",0
Tupac back from the dead,0,Biggie back from the dead,0
An akay 47,0,An m9 pistol with unlimited supply of ammo,0
"Get trapped in a maze, where pac-man is chasing you",0,Get trapped in a maze where chuck norris wants to knock you out,1
Choose to play modern warfare 3,0,Choose to play black ops,1
Live in Gotham,2,Live in Troy,1
Be tortured by a hateful government with millions of dollars of weapons for a week,0,Be tortured by a single hateful man with multi millions of dollars for a day ,0
Watch the walking dead,0,The sapranos,1
Get cut into pieces by wolverine,0,Get stabbed by a horde of toddlers,4
Get 85% on Every Test,0,Win Every Argument,1
M16,1,Ak 47,0
Regenerate health,2,Power when you touch things they decay,0
Upgrade the thunder gun,4,The ray gun,0
Be fully gay or a lesbian,1,Be bi,0
Eat dog poop for a whole day,0,Eat food you don't like for the rest of your life,1
Eat dog poop for a whole day,1,Eat food you don't like for the rest of your life,0
Eat dog poop for a whole day,1,Eat food you don't like for the rest of your life,1
Eat dog poop for a whole day,5,Eat food you don't like for the rest of your life,0
Eat your body,0,Starve to death and have a 25% chance of survival,3
Be forced to take a key out of your eyeball and unlock your,77092,Dip your hand in acid to take the key out before it rips out your ribs,118463
"Rub Snuff (Skoal, Copenhagen, Grizzly, etc.)",0,"Smoke Cigarettes (Marlboro, Newport, L&M, etc.)",1
Cut Off Your Finger With A Better Knife ,5,One Of Your Loved Ones Pass Away In A Tragic Accident ,0
Suck a dick.,0,Lick an ass,2
Be a dragon,1,Be batman,0
Jessica Alba,0,Emma Watson,0
Captain Jack Sparrow,2,James Bond,0
Shoot your little brother in the face with a desert eagle gun,2,Pull the plug on your mom,0
Have every question actually happen,0,Have every question not happen,1
Drink a glass pus,0,Eat a spoon of cinnamon,0
Rape a lot of people during your life,1,Have sex only once in your life,3
Would you be eaten by pirahnas,0,Or be half chewed by a shark then chewed by an oversized mutated dolphin,1
Put a shopping cart of cats into your oven and bake them at 300 degrees for an hour,0,Run over 12 toddlers with an SUV,1
Have the name Peeta,1,Cut a toe off,0
Joseph Stalin,1,Adolf Hitler,0
Walmart,4,McDonalds,0
Dip your face in 100% lemon juice,17,Punch your mom in the face,15
Die a VERY VERY slow and painful death,2,Get raped several times a day by inmates everyday in prison,0
Cut off your own penis,0,Tear out your own eyes,1
Work at mcdonalds,0,Work at walmart,1
Live in Chicago,3,Live in Houston,0
No legs and hearing,0,No arms and sight,0
Have gravity shut off for 1 day,1033249,Have everyone around you go insane and want to kill you,138261
Burning hot coals,0,Brick shaped Lego's,2
Know how people would react to your death.,0,Know if you will go to heaven or hell.,0
Ride the Texas Gaint,0,Ride the Texas Titan,0
Be a dragon,0,Be dragon born,1
Be a dragon,1,Be dragon born ,1
Be constantly falling through a black hole,1,Constantly raped by your maths teacher,0
Only have sex with animals,1,Never have sex,2
Short hair,2,Long hair,1
Eat ten lives spiders ,0,Wear only the color green for the rest of your life,3
Big Bang,1,One Direction,0
"Catch your ""date"" kissing your achenemy",2,"Catch your best friend kissing your ""date""",0
Mark Smith,0,Christopher Eccleston,0
American,1,British,2
Be enchanted by anything to do with dragons,1,Collect anything that had to do with dragons,0
Be hated for who you are,17,Be Loved for who you're not,14
Be married to your brother/sister,0,Be married to your cousin,5
Have the ability to fast forward you life,0,Have the ability to rewind your life,2
Be on the Lusitania,0,Be on the Empress of Ireland,1
Have a one time ticket to kill any person in the world and have no repercussions,1,Have a one time ticket to get a bucket of any type of ice cream of your choosing,0
Eat the diarrhea of a llama and lick its anus.,0,Make out with Gollums asshole for 5 minutes,0
Kill u/him/her,0,Keep humans alive in history and start a family with them/her/him,0
Be an idiot but sane,0,Be a genius but crazy,1
Do nothing but get whatever you want,2,Be hardworking & kind but get nothing,0
Be a Grammar Nazi,1,Bee horibblee at speliin but nise,2
Choose to have a very intelligent family but also very strict,2,Choose to have a very stupid family but also very kind,1
Be trapped in the middle of shark invested oceans,0,Be trapped In a paranormal and abandoned insane asylum ,0
Live in europe in the dark ages,0,Live in arabia in the dark ages (arabian golden age),0
Meet Morgan Freeman,0,Become Morgan Freeman,0
Fight a psycho who has two knifes but is unfit ,0,Fight a fit boxer who could beat you to death ,0
Always smell bad,0,Always wear ugly clothes,1
Get herpes from Megan Fox,2,Blowjob from Rosie O'donell,0
Margaret Thatcher ,0,Queen Elizabeth II ,0
Jacob,0,Edward,0
Never watch porn again,3,Never masturbate,1
Sneeze marbles,0,Fart confetti,0
Be a fish waist down,1,Be a fish waist up,0
Conan,0,Jerry Springer,1
Assassin,2,Templar,0
Die now,0,Live FOREVER,0
Get killed by Kratos,0,Get killed by Goku,1
Stick your tongue in boiling water for 30 seconds,1,Stick your finger in a pencil sharpener that was on,1
Be Tom Kenny's (creator and voice of Spongebob) child,1,Be Trey Parker's (co-creator and some voices of South Park) child,1
"Ugly, but an amazing personality",2,"Attractive, but very rude",0
Be alone in the woods,2,Be alone in the woods when it is pooring rain,0
Have nipples for eyes and eyes for nipples,0,Have a belly button for a mouth and a mouth for a belly button,0
Go to England,1,Go to France,0
Die young,2,Live forever old,0
Get knocked out,2,Get hit in the nuts ,0
Have your testicles crushed or ovaries ripped out,0,Win a billion dollars,0
Freeze to Death,1,Burn to Death,0
Be alone in the woods at night,3,Be alone in the woods at night when it it pouring rain,0
Have eyes for nipple and nipple for eyes,1,Have a mouth for a belly button and a belly button for a mouth,0
Have a puppy sized elephant,1,Have a elephant sized puppy,0
Get mauled by various animals,2,Die from an STD,0
James Bond,0,Jonny English ,0
Be immortal but forever depressed,0,Die right now,1
Fly a hot air balloon,0, Fly an airplane,1
Lady Gaga,0,Katy Perry,1
Kiss you inside out -Hedley,0,Where have you been -Rhianna,0
I-phone,0,Blackberry,0
Pepsi,0,Coke,1
Tank,0,Fighter Plane,0
Time travel back to 1969 to listen to the beatles ,1,Time travel to 2050,1
Have toothpicks pry open your eyelids for 2 hours straight,0,"Be forced to have sex with 3, 7 foot tall black men, until they are done with you",0
Join the Justice League,1,Join The Avengers,5
Drake,0,Lil Wayne,0
Hulk,0,Iron Man,0
Be dipped in scid,0,Get eaten slowly by rats and humans,0
Sleep in a cold bed,1,Sleep in a warm but noticeably hot bed,0
Make out with dad and put it on youtube,0,Eat best friends poop in front of him,0
Chew of a baby's penis,0,Get hardcore anal by Vin Diesel for 15 minutes,0
Be a teddy bear,1,Be a action figure,0
Be a teddy bear,0,Be a action figure,1
Be a teddy bear,2,Be a action figure,0
Be a teddy bear,0,Be a action figure,4
Kill a innocent civilian and live,3,Dont kill anyone but someone kills you,0
Listen to justin beiber for 3 minutes,0,Get kicked by chuck norris for 3 seconds,1
Get friend zoned,1,Drink a bottle of pis and eat a poop burger?,0
Have Cyborg arms,0,Have Cyborg legs,2
Get fucked by Godzilla,1,Get fucked by King Kong,4
Loose a Thumb,0,Loose an Arm,0
Be able to record and playback your dreams.,3,"Control your house with your mind (TV, CPU, Closing/Opening Windows/Doors)",5
Listen to justin beiber for 3 mins,3,Get kicked by chuck norris for 5 secs,1
Spend your/the last few hours with ur family/love ones and say goodbye to friends,1,Spend the last few hours with your friends and your secret crush ,1
Wish To have 5 wishs,1,Wish to have the ability. To go back/forward in time when ever u want ,0
Be buried alive in a casket with an evil clown,0,"Be locked in a dark, small closet with a 100 snakes",1
Be caught in the terrorist attack of 9/11 (on the 100th floor and you dont die right away),1,Be in Adolf Hitlers Concentration Camp,0
Have to go to school every day for 11 years,0,Go to school 3 times every year for the rest of your life,1
"Marry someone that had a great, amazing personality but super ugly and disgusting ",0,"Marry someone that had a rude, and horrible personality but extremely cute and great looking",0
Be a male with periods but have everything on your body perfect ,3,Be a female with no periods and have everything on your body perfect,2
Live in a Zombie Apocalypse,3,Live in a Robot Apocalypse,1
Lose the next 10 years of your life.,0,Lose the last 20 years of your life.,1
Eat a human fetus,0,Eat an entire buck including the antlers,1
"Be under house arrest for the rest of your life, but eat gourmet food for each of your meals.",2,"Live in an extravagant mansion and while being able to leave freely, but only eat soggy cabbage.",1
Go naked on stage in a theatre play.,471,Work as a stripper in a bar for a week.,417
Go naked on stage in a theatre play.,1,Work as a stripper in a bar for a week.,0
Your teacher (who is a sex offender),2,"A person of the same sex, making your schoolmates think you're a homo",1
Watch porn with your parents ,0,"Watch porn with your teachers with everyone naked, including you",1
